"""Shipper Name""","Shipper Address","""Consignee Name""","Consignee Address","""Notify Party Name""","Notify Party Address","""Also Notify Party Name""","Also Notify Party Address","Weight","Weight Unit","Measure","Measure Unit","Quantity","""Carrier Name""","SCAC","Vessel Name","Voyage Number","Bill of Lading Number","IMO Number","Country of Origin","Port of Arrival","Port of Departure","Foreign Destination","Arrival Date","Container Number","Container Piece Count","Commodity","Marks Container Number","Marks Description","Clearing District","Place of Receipt"
"DAMCO CHINA LIMITED O/B","SHIPPERS 338 NANJING ROAD 3/F, TIAN|AN CENTRE 200003 SHENYANG SHANGHAI|PEOPLES REPUBLIC OF CHINA","STAPLES BRANDS GROUP","A DIVISION OF STAPLES, THE OFFICE|SUPERSTORE, LLC 500 STAPLES DRIVE|FRAMINGHAM, MA  01702","EXPEDITORS INTERNATIONAL OF WASHING","T  ATTN: STAPLES TEAM 3 TECHNOLOGY|DRIVE PEABODY, MA 01960|PHONE (978)531-0001","ORDER","","13503.46","KG","62","CM","973","MAERSK LINE","MAEU","CMA CGM ATTILA","793S","MAEU568865614","9433793","PEOPLES REP OF CHINA","NEW YORK","SHANGHAI","","04/01/2013","MSKU1795186      MSKU1795186 MSKU1795186       MSKU1795186                     MSKU1795186  ","416      277 125       110                     45  ","160 CARTONS 8.5X11.75 PERF PAD CANARY 12PK  RECYCLED  HTS CO DE 4820102020  156 CARTONS   8 .5X14 PERF PAD CANARY 12PK  RE CYCLED  12 CARTONS  8.5X11 GLU ETOP NRW CANARY 12PK  RECYCLED 3 CARTONS  DUAL PAD 5X8 CANARY 6PK MEDIUM  RULED  60 CART ONS  HEAVY SHEET PROTECTORS 10 0CT   CLEAR  3 CARTONS  MEMO 5 X8 NARROW RULED CANARY  12PK 5 0SHT  22 CARTONS   3.3MIL HEAV Y DUTY SHEET  PROTECTORS PACK OF 200  MSKU1795186 277 CARTONS TASK CHAIR VEDIA F ABRIC BLACK  HTS CODE 94013080 30  MSKU1795186 4 CARTONS 11 SLOT FILE ORGANIZ ER CHROME  HTS CODE 8304000000 71 CARTONS  STAPLES 8 SLOT V ERT ORG BLK   1 CARTONS  DESKT OP ORGANIZER BLACK  3 CARTONS MESH FILE BOX BLACK  1 CARTO NS   MESH DOODAD CUP SMALL BLACK  1 CARTONS  MESH LARGE PENC IL CUP BLACK  12 CARTONS  STAP LES ROTARY DESK ORGANIZER   2 CARTONS  MESH PENCIL CUP BLACK 17 CARTONS  FESH PENCIL CUP BLACK  9 CARTONS   ROTARY DESK ORGANIZER BLACK  SMALL  4 CAR TONS  3 TIERED DESK SHELF SILVER  MSKU1795186 1 CARTONS 5PK IDENT-A-COVER AS ST COLORS  HTS CODE 3926100000 2 CARTONS  SUCTION CUPS WITH HOOKS 6PK   4 CARTONS  PORT B LUE TANG W 2 PKT-1PK  10 CARTO NS  PORTFOLIO RPT CVR BURG 2-P KT  1PK   10 CARTONS  EXPANDING CRATE ON WHEELS  BLACK  1 CA RTONS  5PK SLASH JACKETS W/3 H OLES   CLEAR  4 CARTONS  5PK P ROJECT JACKETS LETTER  SIZE AS ST  2 CARTONS   PRES BK 24 SLV CLEAR FRT WHT  3 CARTONS  25 PK EASY VIEW HANGING FILE  FOL DER ASST COLORS  1 CARTONS   EXPANDING HANGING POLY FILE  4 CARTONS  BADGE CLIP WITH CLEAR TPU  STRAP IN OPP BAG 100PK 4 CARTONS   1/3 TAB FOLD VW 6P K CLEAR  8 CARTONS  EXPANDING FILE LETTER POLY BLK  6 CARTON S  STAPLES BRAND BOARD ERASER 4 CARTONS  TWO POCKET PORTFOLIO LETTER  METALLIC BURGUNDY 9 CARTONS  TWO POCKET PORTFOL IO LETTER   METALLIC GREEN  1 CARTONS  TWO POCKET PORTFOLIO LETTER  METALLIC BLUE  10 CART ONS   TWO POCKET PORTFOLIO LET TER  METALLIC BLACK  1 CARTONS SWING LOCK REPORT COVER  METALLIC BLACK   8 CARTONS  TWO P OCKET PORTFOLIO W/ PRONG  LETT ER METALLIC BLUE  2 CARTONS  E XPANDING FILE BLACK   1 CARTON S  NAME BADGE VERTICAL 50PCS 1 CARTONS  NAME BADGE HORIZONT AL BOX OF  50PCS   1 CARTONS JOB TICKET HOLDER SEWN 9X12  25PK  2 CARTONS  SPLS TOPOPEN E NV LTR ASST 5   4 CARTONS  SID E LOCK REPORT COVER BLACK  5PK 6 CARTONS  SIDE LOCK REPORT COVER BLUE   5PK    SHIPPER DE CLARES THE CARGO TO BE (MADE I N CHINA). THIS DECLARATION, IN CLUDING OTHER CARGO DETAILS HAS NOT BEEN VERIFIED BY OR FOR THE CARRIER WHO SHALL BE WITHO UT ANY RESPONSIBILITY FOR ITS CORRECTNESS AS PER CLAUSE 14 .2 HEREOF  MSKU1795186 45 CARTONS DESCRIPTION: MERCUR Y CORNER  COMPUTER DESK  PO: B L3084  GPS PO: 10567205   OSP PO: 28829  SKU: 807666  GPS SK U: MY1302-CC  MSKU1795186 ","MSKU1795186 MSKU1795186 ","MODEL#:  UNITS  MADE IN  CHINAMODEL#:  UNITS  MADE IN  CHINAMODEL#:  UNITS  MADE IN  CHINAMODEL#:  UNITS  MADE IN  CHINAPO#:BL3084  #:807666  DELIVER  TO:SHANGHAI_  CFS  #OF CARTON:  OF  45  N.W.:  44.44  KG  G.W.:  47.2   KG  MFG.NAME:DEL  Y  MFG.DATE:12-  24-201 2  CCR 93120.2  PLASE 2  CONPLIANTFOR  FORMALDEHYDE ","","SHANGHAI"
"DESEADO INTERNATIONAL LTD","SUITE 3801B-02, 38 F, SKYLINE TOWER|39 WANG KWONG ROAD, KOWLOON BAY,|KOWLOON TEL  27518813   FAX  275189","THE POMEROY COLLECTION","4820 BLALOCK #101 HOUSTON,|TX77041, USA|TEL  713 4605565 FAX  713 4007903","AIR SEA INTERNATIONAL LOGISTICS INC","18001 ALDINE WESTFIELD ROAD|HOUSTON, TX 77073|CTC  SHANNON LIU","ORDER","","12502","KG","66","CM","1758","AMERICAN PRESIDENT LINES","APLU","MOL MOTIVATOR","00014","APLU053775858","9475624","PEOPLES REP OF CHINA","LOS ANGELES","YANTIAN","","04/01/2013","FCIU8520903  ","1758  ","WALL SHELF AS PER PO#2011976 REPLACEMENT BOX SAMPLES OF LIGHTING DECORATIONS WOODEN TRAY DESEADO REF- DIL2013081  FCIU8520903 ","FCIU8520903 ","PM-IN DIA.-DESC.-PO# -MADE IN CHINACTN NO.- ","","YANTIAN, PC"
"CHIEF MASTER CO.,LTD.","RM 9-10, 8 F., SIU WAI IND., CENTRE|29-33 WING HONG ST., CHEUNG SHA WAN|KOWLOON, HK","MINKA LIGHTING INC","1151 W. BRADFORD CT, CORONA, CA 928|","MINKA LIGHTING INC","1151 W. BRADFORD CT, CORONA, CA 928|","ORDER","","1959","KG","24","CM","495","AMERICAN PRESIDENT LINES","APLU","MOL MOTIVATOR","00014","APLU053776161","9475624","PEOPLES REP OF CHINA","LOS ANGELES","YANTIAN","","04/01/2013","APRU6116186  ","495  ","LIGHTING FIXTURES INVOICE NUMBER-Y427313023 ; THIS SHIPMENT CONTAIN NO WOOD PACKING MATERIALS  APRU6116186 ","APRU6116186 ","MINKA-LAVERYMORENO VALLEY,CAC-NO.DESIGNED INUSAMADE IN CHINA ","","YANTIAN, PC"
"ORDER","","ORDER","","ORDER","","ORDER","","226425","KG","256","CM","170","PANTAINER EXPRES LINE PANALPINA INC","PNEP","AXEL MAERSK","0789S","PNEP13563758184","AXEL MA","PEOPLES REP OF CHINA","CHARLESTON","YANGSHAN","","04/01/2013","MAEU6305391 MAEU6960433 MRKU7155590 MSKU2202011 MSKU2392966 MSKU5657729 MSKU6599355 MSKU7689392 POCU0660599 PONU0438332 PONU0685672 PONU0723828 ","20 20 10 20 20 10 20 10 10 10 10 10 ","BRAKE DRUM  MAEU6305391 WHEEL HUB  MAEU6960433 WHEEL HUB  MRKU7155590 WHEEL HUB  MSKU2202011 WHEEL HUB  MSKU2392966 WHEEL HUB  MSKU5657729 BRAKE DRUM  MSKU6599355 WHEEL HUB  MSKU7689392 WHEEL HUB  POCU0660599 WHEEL HUB  PONU0438332 WHEEL HUB  PONU0685672 WHEEL HUB  PONU0723828 ","MAEU6305391 MAEU6960433 MRKU7155590 MSKU2202011 MSKU2392966 MSKU5657729 MSKU6599355 MSKU7689392 POCU0660599 PONU0438332 PONU0685672 PONU0723828 ","NO MARKS NO MARKS NO MARKS NO MARKS NO MARKS NO MARKS NO MARKS NO MARKS NO MARKS NO MARKS NO MARKS NO MARKS ","","QINGDAO"
"DHL ISC  HONG KONG  LTD","L21,TOWER 1,KOWLOON|COMMERCE CENTRE NO.51 KWAI CHEONG|ROAD KWAI CHUNG,NEW TERRITORIES","BEST BUY PURCHASING LLC","7601 PENN AVENUE SOUTH RICHFIELD|MN 55423,USA|","EXPEDITORS INT L OF WASHINGTON,INC","5757 WEST CENTURY, BLVD. STE 200|ATTN  BEST BUY TEAM|LOS ANGELES CA 90045 T  3103436200","ORDER","","4480","KG","35","CM","1260","AMERICAN PRESIDENT LINES","APLU","MOL MOTIVATOR","00014","APLU053780379","9475624","PEOPLES REP OF CHINA","LOS ANGELES","YANTIAN","","04/01/2013","APZU4275664           ","1260           ","PS3 CHAT HEADSET ORDER# 4000244815 -KPVJFZ ITEM# 3088605 MODEL NO.RF-GPS31201 63 CARTON 1008.0 PIECES THIS SHIPMENT CONTAINS NO WOOD PACKAGING MATERIALSPS VITA VAULT CASE ORDER# 4000244815 -KPVJFZ ITEM# 4611274 MODEL NO.RF-PSV1301 188 CARTON 1504.0 PIECES PS3 CHAT HEADSET ORDER# 4000245764 -KQQGXK ITEM# 3088605MODEL NO.RF-GPS31201 93 CARTON 1488.0 PIECES PS VITA VAULT CASE ORDER# 4000245764 -KQQGXK ITEM# 4611274 MODEL NO.RF-PSV1301 375 CARTON 3000.0 PIECES NINTENDO 3DS-XL GO CASEORDER# 4000245764 -KQQGXK ITEM# 6314675 MODEL NO.RF-GDS1302 250 CARTON 3000.0 PIECES NINTENDO 3DS PRO STYLUS AND SCREEN KIT ORDER# 4000245764 -KQQGXK ITEM# 6314702MODEL NO.RF-GDS1301 41 CARTON 984.0 PIECES XBOX 360 CHAT HEADSET ORDER# 4000245764 -KQQGXK ITEM# 6314757 MODEL NO.RF-GXB1301 250 CARTON 3000.0 PIECES  APZU4275664 ","APZU4275664 ","BBCHBBCHBBCHBBCHBBCHBBCHBBCH ","","YANTIAN, PC"
"SHENYE AIR NAIL(ZHONGSHAN) CO., LTD","SOUTHERN SHENGHUI INDUSTRIAL|ZONE, NANTOU TOWN,ZHONGSHAN|CITY,GUANGDONG, CHINA TEL:0760-2312","CARLON SYSTEMS, LLC","890 ELKTON DRIVE SUITE 107 COLORADO|SPRINGS CO 80907|TEL: 402-593-5305 FAX: 402-597-5168","CARLON SYSTEMS, LLC","890 ELKTON DRIVE SUITE 107 COLORADO|SPRINGS CO 80907|TEL: 402-593-5305 FAX: 402-597-5168","ORDER","","17413","KG","0","","1450","LAUFER FREIGHT LINES INC","LUFR","OOCL ASIA","58E11","LUFRZHS13030060","OOCL AS","PEOPLES REP OF CHINA","LONG BEACH","HONG KONG","","04/01/2013","CLHU2966130 ","1450 ","STEEL STAPLES IN STRIPS  CLHU2966130 ","CLHU2966130 ","CARLSON SYSTEMS, LLCP/O NO.:25029740COLORADOP/NO.:MADE IN CHINA ","","XIAOLAN"
"TRAYTON FURNITURE (JIAXING) CO;LTD","CHINA 314000 ZHEJIANG,JIASHAN,INDUS|JIASHAN 33 314000 CHINA|","IKEA SUPPLY AG C/O IKEA DISTRIBUTIO","100 IKEA DRIVE 08060 WESTAMPTON, NJ|WESTAMPTON NJ 08060 UNITED STATES|","IKEA WHOLESALE INC","100 IKEA WAY WESTAMPTON, NJ 08060 U|WESTAMPTON NJ 08060 UNITED STATES|","OHL INC. THE NAVY YARD","5101 SOUTH BROAD STREET 19112, PHIL|PHILADELPHIA PA 19112 UNITED STATES|","3682","KG","57","X","43","MEDITERRANEAN SHIPPING COMPANY","MSCU","HANSA ATLANTIC","309R","MSCUE7946048","9112571","PEOPLES REP OF CHINA","PHILADELPHIA","FREEPORT","","04/01/2013","TCNU8197993  ","43  ","IKEA HOME FURNISHING PRODUCTS SHIPMENT ID:037 -TSO-S387965 CONSIGNMENT: 21127-SUP-ECIS12174 86PCS CY TO CY  TCNU8197993 ","TCNU8197993 ","N/MSAMESAME ","","SHANGHAI"
"ORDER","","ORDER","","ORDER","","ORDER","","49111","KG","0","","2541","SEIYO SHIPPING COMPANY LTD","SEYO","NYK THESEUS","023E","SEYOEM13025444","9356701","PEOPLES REP OF CHINA","LOS ANGELES","SHANGHAI","","04/01/2013","OOLU3003470  OOLU3634027  TCKU3693574  ","818  931  792  ","STEEL PIPE NIPPLES AS PO#33104 COOPLETS AND S TEEL PIPE NIPPLES AS PER PO#32924  OOLU3003470 STEEL PIPE NIPPLES AS PO#33104 COOPLETS AND S TEEL PIPE NIPPLES AS PER PO#32924  OOLU3634027 STEEL PIPE NIPPLES AS PO#33104 COOPLETS AND S TEEL PIPE NIPPLES AS PER PO#32924  TCKU3693574 ","OOLU3003470 OOLU3634027 TCKU3693574 ","N/M N/M N/M ","","QINGDAO"
"ANHUI TECHNOLOGY IMP&EXP CO.LTD","NO.459 CHANGJIANG ROAD,HEFEI CHINA|","BEST FOOD SERVICE INC","7131 W 61ST STCHICAGO, IL 60638|","BEST FOOD SERVICE INC","7131 W 61ST STCHICAGO, IL 60638|","ORDER","","19354","KG","0","X","1008","TOPOCEAN CONSOLIDATION SERVICE INC","TOPO","NYK THESEUS","023E","TOPOQDOORDD30171","NYK THE","PEOPLES REP OF CHINA","LOS ANGELES","SHANGHAI","","04/01/2013","OOLU1825873 ","1008 ","CANNED PEAR  OOLU1825873 ","OOLU1825873 ","NO MARKS ","","SHANGHAI,CN"
"ORDER","","ALLTRADE TOOLS,LLC","1431 VIA PLATA,LONG BEACH,CA 90810|PHONE FAX  310-522-9008 EXT 1229|ATTN MS. JAMIE HO","ORDER","","ORDER","","41151","KG","124","CM","3404","AMERICAN PRESIDENT LINES","APLU","APL IOLITE","00170","APLU066572898","9144756","PEOPLES REP OF CHINA","LOS ANGELES","SHANGHAI","","04/01/2013","APZU4407122                 APZU4671599                 FCIU4086300                 ","1136                 1134                 1134                 ","1-2- 7A IMPACT WRENCH HTS #- 8207506000 FREIGHT COLLECT 10 GALLON AIR TANK HTS #- 7311000090 2 TON BOTTLE JACK HTS #- 84254200003-8- 3.2A VSR ELECTRIC DRILL HTS #- 8207506000 3-8- CALIPER WRENCH HTS #- 8204110060 36PC COLORED BIT SET W-INJECTI HTS #- 8207506000 3PC WIRE BRUSH SET HTS #- 96039080504.8V CDLS FOLDING SCREWDRIVER HTS #- 8467210010 46PC TOOL SET W-16-TOOL BOX HTS #- 4202999000 5-8-T-HDL SPRING-LOAD SPARK PL HTS #- 8204200000 500PC RIVET ASSORTMENT HTS #- 76161030008- ADJUSTABLE WRENCH HTS #- 8204120000 COMBO SNAP RING PLIERS HTS #- 8203206030 KW GREEN 8- BENCH GRINDER W-LT HTS #- 8460390020 SEAWAYBILL 1-2- DR. FLEXIBLE HANDLE 24--CHTS #- 8204200000 1400PSI ELECTRIC PRESSURE WASHER HTS #- 8431491090 2 TON PB TROLLEY JACK HTS #- 8425420000 24PC HOUSEHOLD TOOL SET HTS #- 8204110060 24V 1-2- IMPACT WRENCH KITHTS #- 8467290040 26 BLADE MASTER GAUGE HTS #- 9031808085 2700PSI GAS PRESSURE WASHER 7H HTS #- 8424309000 3PC MFT-FOLDING KNIFE LIGHT 6 TON RACHETING JACK STAND HTS #- 7326908588COLOR BOX HEAT GUN WITH 4 PC NOZZLES HTS #- 8205600000 KW 6-32NC TAP 7-64- DRILL BT HTS #- 8207406000 RECIPROCATING SAW HTS #- 8467220070 ROTARY TOOLHTS #- 8467290090 SEAWAYBILL 4-1-2- 4.2A ANGLE GRINDER HTS #- 8467290010 7- 10A VS SANDER-POLISHER HTS #- 8467111040  APZU4407122 1-2- 7A IMPACT WRENCH HTS #- 8207506000 FREIGHT COLLECT 10 GALLON AIR TANK HTS #- 7311000090 2 TON BOTTLE JACK HTS #- 84254200003-8- 3.2A VSR ELECTRIC DRILL HTS #- 8207506000 3-8- CALIPER WRENCH HTS #- 8204110060 36PC COLORED BIT SET W-INJECTI HTS #- 8207506000 3PC WIRE BRUSH SET HTS #- 96039080504.8V CDLS FOLDING SCREWDRIVER HTS #- 8467210010 46PC TOOL SET W-16-TOOL BOX HTS #- 4202999000 5-8-T-HDL SPRING-LOAD SPARK PL HTS #- 8204200000 500PC RIVET ASSORTMENT HTS #- 76161030008- ADJUSTABLE WRENCH HTS #- 8204120000 COMBO SNAP RING PLIERS HTS #- 8203206030 KW GREEN 8- BENCH GRINDER W-LT HTS #- 8460390020 SEAWAYBILL 1-2- DR. FLEXIBLE HANDLE 24--CHTS #- 8204200000 1400PSI ELECTRIC PRESSURE WASHER HTS #- 8431491090 2 TON PB TROLLEY JACK HTS #- 8425420000 24PC HOUSEHOLD TOOL SET HTS #- 8204110060 24V 1-2- IMPACT WRENCH KITHTS #- 8467290040 26 BLADE MASTER GAUGE HTS #- 9031808085 2700PSI GAS PRESSURE WASHER 7H HTS #- 8424309000 3PC MFT-FOLDING KNIFE LIGHT 6 TON RACHETING JACK STAND HTS #- 7326908588COLOR BOX HEAT GUN WITH 4 PC NOZZLES HTS #- 8205600000 KW 6-32NC TAP 7-64- DRILL BT HTS #- 8207406000 RECIPROCATING SAW HTS #- 8467220070 ROTARY TOOLHTS #- 8467290090 SEAWAYBILL 4-1-2- 4.2A ANGLE GRINDER HTS #- 8467290010 7- 10A VS SANDER-POLISHER HTS #- 8467111040  APZU4671599 1-2- 7A IMPACT WRENCH HTS #- 8207506000 FREIGHT COLLECT 10 GALLON AIR TANK HTS #- 7311000090 2 TON BOTTLE JACK HTS #- 84254200003-8- 3.2A VSR ELECTRIC DRILL HTS #- 8207506000 3-8- CALIPER WRENCH HTS #- 8204110060 36PC COLORED BIT SET W-INJECTI HTS #- 8207506000 3PC WIRE BRUSH SET HTS #- 96039080504.8V CDLS FOLDING SCREWDRIVER HTS #- 8467210010 46PC TOOL SET W-16-TOOL BOX HTS #- 4202999000 5-8-T-HDL SPRING-LOAD SPARK PL HTS #- 8204200000 500PC RIVET ASSORTMENT HTS #- 76161030008- ADJUSTABLE WRENCH HTS #- 8204120000 COMBO SNAP RING PLIERS HTS #- 8203206030 KW GREEN 8- BENCH GRINDER W-LT HTS #- 8460390020 SEAWAYBILL 1-2- DR. FLEXIBLE HANDLE 24--CHTS #- 8204200000 1400PSI ELECTRIC PRESSURE WASHER HTS #- 8431491090 2 TON PB TROLLEY JACK HTS #- 8425420000 24PC HOUSEHOLD TOOL SET HTS #- 8204110060 24V 1-2- IMPACT WRENCH KITHTS #- 8467290040 26 BLADE MASTER GAUGE HTS #- 9031808085 2700PSI GAS PRESSURE WASHER 7H HTS #- 8424309000 3PC MFT-FOLDING KNIFE LIGHT 6 TON RACHETING JACK STAND HTS #- 7326908588COLOR BOX HEAT GUN WITH 4 PC NOZZLES HTS #- 8205600000 KW 6-32NC TAP 7-64- DRILL BT HTS #- 8207406000 RECIPROCATING SAW HTS #- 8467220070 ROTARY TOOLHTS #- 8467290090 SEAWAYBILL 4-1-2- 4.2A ANGLE GRINDER HTS #- 8467290010 7- 10A VS SANDER-POLISHER HTS #- 8467111040  FCIU4086300 ","APZU4407122 APZU4407122 APZU4407122 APZU4407122 APZU4671599 FCIU4086300 ","ALLTRADEALLTRADEALLTRADEALLTRADEALLTRADEALLTRADEALLTRADEALLTRADE ALLTRADEALLTRADEALLTRADEALLTRADEALLTRADEALLTRADEALLTRADEALLTRADE ALLTRADEALLTRADEALLTRADEALLTRADEALLTRADEALLTRADEALLTRADEALLTRADE ALLTRADEALLTRADEALLTRADEALLTRADE MARKS AND NUMBERS WITH CONTAINER  APZU440712 MARKS AND NUMBERS WITH CONTAINER  APZU440712 ","","SHANGHAI, PC"
"CHANGDE DINGYUAN CHEMICAL","INDUSTRIAL LIMITED DONGFENG VILLAGE|NANPING TOWNSHIP WULING DISTRICT|CHANGDE HUNAN CHINA","WESTERN RESERVE CHEMICAL","CORPORATION WRC C O DURA FREIGHT LI|NES WAREHOUSE #2 20595 E. BUSINESS|PARKWAY WALNUT,CA 91789 USA","WESTERN RESERVE CHEMICAL","CORPORATION WRC C O DURA FREIGHT LI|NES WAREHOUSE #2 20595 E. BUSINESS|PARKWAY WALNUT,CA 91789 USA","ORDER","","7560","KG","0","X","300","GLOBAL OCEAN AGENCY LINES LLC","GOAG","NYK LODESTAR","082E","GOAGQDA1303040AA","NYK LOD","PEOPLES REP OF CHINA","LOS ANGELES","QINGDAO","","04/01/2013","OOLU7654886 ","300 ","1000KGS OF 6PPD GRANULAR  OOLU7654886 ","OOLU7654886 ","N M ","","QINGDAO"
"DONGYING BOCHEN CHEMICAL","CTP PVI CO.,LTD DAWANG TOWN,DONGYIN|G CITY,SHANDONG PROVINCE,CHINA|","WESTERN RESERVE CHEMICAL","CORPORATION 4837 DARROW ROAD STOW,O|HIO 44224 USA|","WESTERN RESERVE CHEMICAL","CORPORATION 4837 DARROW ROAD STOW,O|HIO 44224 USA|","ORDER","","1587","KG","0","X","60","GLOBAL OCEAN AGENCY LINES LLC","GOAG","NYK LODESTAR","082E","GOAGQDA1303040AB","NYK LOD","PEOPLES REP OF CHINA","LOS ANGELES","QINGDAO","","04/01/2013","OOLU7654886 ","60 ","RUBBER CHEMICALS  OOLU7654886 ","OOLU7654886 ","N M ","","QINGDAO"
"HENAN KAILUN CHEMICAL CO.,LTD","25-JIE FANG NORTH ROAD HUAXIAN HENA|N CHINA|","WESTERN RESERVE CHEMICAL","CORPORATION 4837 DARROW ROAD STOW,O|HIO 44224 USA|","WESTERN RESERVE CHEMICAL","CORPORATION 4837 DARROW ROAD STOW,O|HIO 44224 USA|","ORDER","","3024","KG","0","X","120","GLOBAL OCEAN AGENCY LINES LLC","GOAG","NYK LODESTAR","082E","GOAGQDA1303040AC","NYK LOD","PEOPLES REP OF CHINA","LOS ANGELES","QINGDAO","","04/01/2013","OOLU7654886 ","120 ","ACCELERATOR MBTS(PO)  OOLU7654886 ","OOLU7654886 ","N M ","","QINGDAO"
"SINOCHEM LIAONING CORPORATION","23 RENMIN ROAD,DALIAN 116001 CHIN|","WRC C O DURA FREIGHT,","WAREHOUSE #2,20595 EAST BUSINESS PK|WY,WALNUT CA 91789 USA|","WRC C O DURA FREIGHT,","WAREHOUSE #2,20595 EAST BUSINESS PK|WY,WALNUT CA 91789 USA|","ORDER","","1010","KG","0","X","50","GLOBAL OCEAN AGENCY LINES LLC","GOAG","NYK LODESTAR","082E","GOAGQDA1303040AD","NYK LOD","PEOPLES REP OF CHINA","LOS ANGELES","QINGDAO","","04/01/2013","OOLU7654886  ","50  ","2,2'-METHYLENE-BIS(6-TERT-BUTYL-4-METHYL PHENOL) 2246 POWDER 50BAGS =2PALLETS  OOLU7654886 ","OOLU7654886 ","WESTERN RESERVE CHEMICALNO MARKS ","","QINGDAO"
"ZIBO HUAMEI CHEMICAL CO.,LTD.","GAOQING COUNTRY,ZIBO CITY,SHANDONG|PROVINCE,PR CHINA,256300 CHINA|","WESTERN RESERVE CHEMICAL","CORPORATION WRC C O DURA FREIGHT, W|AREHOUSE #2 20595 EAST BUSINESS PAR|KWAY WALNUT,CA 91789 USA","WESTERN RESERVE CHEMICAL","#2 20595 EAST BUSINESS PARKWAY WALN|UT,CA 91789 USA|","ORDER","","4128","KG","0","X","160","GLOBAL OCEAN AGENCY LINES LLC","GOAG","NYK LODESTAR","082E","GOAGQDA1303040AE","NYK LOD","PEOPLES REP OF CHINA","LOS ANGELES","QINGDAO","","04/01/2013","OOLU7654886 ","160 ","TBBS POWDER OILED  OOLU7654886 ","OOLU7654886 ","RUBBER ACCELERATOR ","","QINGDAO"
"SHANGHAI ROKEM INTERNATIONAL","CO.,LTD 9D DOUBLE DOVE GREAT TOWER|438 PUDIAN ROAD.SHANGHAI|","WESTERN RESERVE CHEMICAL","CORPORATION 4837 DARROW ROAD STOW,O|HIO 44224 USA|","WESTERN RESERVE CHEMICAL","CORPORATION 4837 DARROW ROAD STOW,O|HIO 44224 USA|","ORDER","","2485","KG","0","X","70","GLOBAL OCEAN AGENCY LINES LLC","GOAG","NYK LODESTAR","082E","GOAGQDA1303040AF","NYK LOD","PEOPLES REP OF CHINA","LOS ANGELES","QINGDAO","","04/01/2013","OOLU7654886 ","70 ","LIGHT YELLOW PETROLATUM  OOLU7654886 ","OOLU7654886 ","N M ","","QINGDAO"
"ORDER","","ORDER","","ORDER","","ORDER","","52227","KG","1388","CM","49","ORIENT OVERSEAS CONTAINER LINE","OOLU","NYK THESEUS","023E","OOLU3080796680","9356701","PEOPLES REP OF CHINA","LOS ANGELES","SHANGHAI","","04/01/2013","OOLU1853284 TCLU2429029 TCLU3405850 ","17 16 16 ","POWER LINE FITTINGS  OOLU1853284 POWER LINE FITTINGS  TCLU2429029 POWER LINE FITTINGS  TCLU3405850 ","OOLU1853284 TCLU2429029 TCLU3405850 ","N/M N/M N/M ","","QINGDAO"
"GREAT FOOD (DEHYDRATION) CO., LTD.","LUMPINI TOWER BUILDING 1168/64, 22N|BANGKOK .|THAILAND","GOLD HARBOR COMMODITIES, INC.","9750 THIRD AVENUE N.E, SUITE 302|SEATTLE WA|UNITED STATES","GOLD HARBOR COMMODITIES, INC.","9750 THIRD AVENUE N.E, SUITE 302|SEATTLE WA|UNITED STATES","ORDER","","17640","KG","803","CM","840","ORIENT OVERSEAS CONTAINER LINE","OOLU","NYK THESEUS","023E","OOLU3080797220","9356701","PEOPLES REP OF CHINA","LOS ANGELES","SHANGHAI","","04/01/2013","OOLU1918180 ","840 ","DEHYDRATED FRUITS  OOLU1918180 ","OOLU1918180 ","GOLD HARBOR-CWI 910910-0114-03413-060(ITEM# 1,2) ","","QINGDAO"
"ORDER","","ORDER","","ORDER","","ORDER","","372","KG","8","CM","92","AMERICAN PRESIDENT LINES","APLU","MOL MOTIVATOR","00014","APLU053950359","9475624","PEOPLES REP OF CHINA","LOS ANGELES","YANTIAN","","04/01/2013","APHU7195929       ","92       ","STYLE#F3536DS WOMENS KNIT MMF PANTY PO 083826 STYLE#F3536DS WOMENS KNIT MMF PANTY PO 084063 STYLE#F3536DSWOMENS KNIT MMF PANTY PO 084065 STYLE#F3536DS WOMENS KNIT MMF PANTY PO 084067 STYLE#F3569DS WMNS MMF BRA-NO LEAVERS LACE-EMBROIDERY- PO 083827STYLE#F3569DS WMNS MMF BRA-NO LEAVERS LACE-EMBROIDERY- PO 084064 STYLE#F3569DS WMNS MMF BRA-NO LEAVERS LACE-EMBROIDERY- PO 084066 STYLE#F3569DS WMNS MMF BRA-NO LEAVERSLACE-EMBROIDERY- PO 084068  APHU7195929 ","APHU7195929 APHU7195929 APHU7195929 APHU7195929 APHU7195929 APHU7195929 APHU7195929 APHU7195929 APHU7195929 APHU7195929 ","CARTON NO-STYLE NO-P.O. NO.COLOR-COLORCODE -SIZE-QTYG.W. N.WMEASCARTON NO-STYLE NO-P.O. NO.COLOR-COLORCODE -SIZE- QTYG.W.N.WMEASCARTON NO-STYLE NO-P.O. NO.COLOR-COLOR CODE -SIZE-QTYG.W.N.WMEASCARTON NO-STYLE NO- P.O. NO.COLOR-COLORCODE -SIZE-QTYG.W.N.WMEAS CARTON NO-STYLE NO-P.O. NO.COLOR-COLORCODE -SIZE-QTYG.W. N.WMEASCARTON NO-STYLE NO-P.O. NO.COLOR-COLORCODE -SIZE- QTYG.W.N.WMEASCARTON NO-STYLE NO-P.O. NO.COLOR-COLOR CODE -SIZE-QTYG.W.N.WMEASCARTON NO-STYLE NO- P.O. NO.COLOR-COLORCODE -SIZE-QTYG.W.N.WMEAS ","","YANTIAN, PC"
"AUTO ALLIANCE GROUP INC.","SUITE A, 19TH FLOOR, AUSTIN ROAD, T|HONG KONG|HONGKONG,,HK","VISION WHEELS,INC","3512B 6TH,AVE.SE.DECATUR AL 35603|DECATUR,,US|","ORDER","","ORDER","","12061","KG","0","","1220","INTERTRANS EXPRESS INC","IEXI","YM SHANGHAI","068E","IEXISMASHK031035","9157650","PEOPLES REP OF CHINA","LOS ANGELES","SHANGHAI","","04/01/2013","YMLU4980036 ","1220 ","ALUMINUM WHEELS  YMLU4980036 ","YMLU4980036 ","N/M ","","SHANGHAI"
"HESHAN QINWEI GARDEN POTTERY CO LTD","3RD INDUSTRY ZONE NECHENG TOWN|HESHAN|","POTTERY LAND LLC","758 GILMAN STREET|","ORDER","","ORDER","","18200","KG","0","","318","CDS GROUP HOLDINGS LIMITED","CFHL","YM SHANGHAI","068E","CFHLSHA130000618","9157650","PEOPLES REP OF CHINA","LOS ANGELES","SHANGHAI","","04/01/2013","YMLU8068192 ","318 ","POTTERY FLOWER POT  YMLU8068192 ","YMLU8068192 ","N M ","","SHANGHAI"
"HANGZHOU RIXIN IMPORT AND EXPORT CO","1606-1607 GOLDEN PLAZA NO. 118 QING|HANGZHOU ZJ|CHINA","NOON INTERNATIONAL, INC.","SUITE 100 3840 BLACKHAWK ROAD|DANVILLE CA|UNITED STATES","NOON INTERNATIONAL, INC.","SUITE 100 3840 BLACKHAWK ROAD|DANVILLE CA|UNITED STATES","ORDER","","21390","KG","1558","CM","31","ORIENT OVERSEAS CONTAINER LINE","OOLU","NYK THESEUS","023E","OOLU3080929910","9356701","PEOPLES REP OF CHINA","LOS ANGELES","SHANGHAI","","04/01/2013","OOLU6178722 ","31 ","IQF EDAMAME,UNSHELLED SOY BEAN  OOLU6178722 ","OOLU6178722 ","N/M ","","SHANGHAI"
"JIANGSU DUOWEI IMP EXP CO.,LTD","10 XINTUAN STREET DAFENG CITY|JIANGSU CHINA|TEL 86 515 68858055","EASTERN INDUSTRIES","6824 BAY LINE DRIVE P.O. BOX 59925|PANAMA CITY FL,32404 4810 USA|TANYA HEATH 850 769 1200","ORDER","","ORDER","","34971","KG","0","X","35","","NSEL","NYK THESEUS","23E11","NSELJM13030953","NYK THE","PEOPLES REP OF CHINA","LOS ANGELES","SHANGHAI","","04/01/2013","OKZU2110930 OKZU2110988 ","18 17 ","AUTO PARTS WATER PUMP  OKZU2110930 AUTO PARTS WATER PUMP  OKZU2110988 ","OKZU2110930 OKZU2110988 ","N MNO MARKS N MNO MARKS ","","SHANGHAI"
"SHANGHAI MAILIN INTERNATIONAL TRADE","NO.18 CAO XI BEI ROAD|SHANGHAI|CHINA","MANUFACTURER INTL IMPORT FABRIC INC","25105 FRAMPTON AVE|HARBOR CITY CA 90710|USA","ORDER","","ORDER","","21938","KG","0","","1455","","IMAV","NYK THESEUS","023E","IMAVSHLAX1303536","9356701","PEOPLES REP OF CHINA","LOS ANGELES","SHANGHAI","","04/01/2013","TGHU9827698 ","1455 ","TEXTILE FABRICS  TGHU9827698 ","TGHU9827698 ","NO MARKS ","","SHANGHAI, CHINA"
"ORDER","","ORDER","","ORDER","","ORDER","","20116","KG","1133","CM","880","ORIENT OVERSEAS CONTAINER LINE","OOLU","NYK THESEUS","023E","OOLU3080996810","9356701","PEOPLES REP OF CHINA","LOS ANGELES","SHANGHAI","","04/01/2013","OOLU7473342 ","880 ","19.958 MT SODIUM BENZOATE  OOLU7473342 ","OOLU7473342 ","LOT:20130122 ","","SHANGHAI"
"DYNAMIC SOURCE INTERNATIONAL","#65 GOUYUN ROAD, YUHANG DISTRICT|HANGZHOU ZJ|CHINA","AMASH IMPORTS INC.","3707 ROGER B. CHAFFEE MEMORIAL DR.|GRAND RAPIDS MI|UNITED STATES","AMASH IMPORTS INC.","3707 ROGER B. CHAFFEE MEMORIAL DR.|GRAND RAPIDS MI|UNITED STATES","ORDER","","19080","KG","1708","CM","960","ORIENT OVERSEAS CONTAINER LINE","OOLU","NYK THESEUS","023E","OOLU3080997052","9356701","PEOPLES REP OF CHINA","LOS ANGELES","SHANGHAI","","04/01/2013","OOLU7400238 ","960 ","HAND TOOLS  OOLU7400238 ","OOLU7400238 ","MIT ","","SHANGHAI"
