"YESUN ELECTRIC COMPANY LIMITED","SUITE A, 12/F., RITZ PLAZA, 122 AUS|TSIM  SHA  TSUI, KOWLOON, HONG KONG|","BROOKSTONE STORES, INC.","1655 BASSFORD DRIVE|MEXICO, MO 65265|","W.N. EPSTEIN AND CO.INC.","P.O. 45187  ST. LOUIS, MO 63145|ATTN JERRY EPSTEIN|TELEPHONE 314/429-0673, EMAIL  OCEANMEXICO BROOKSTONE.COM","ORDER","","4773","KG","28","X","2041","MOL","MOLU","MOL MOTIVATOR","014E","MOLU13007086321","9475624","PEOPLES REP OF CHINA","LOS ANGELES","YANTIAN","","04/01/2013","GLDU5150581             ","2041             ","2041  PKG DUAL GROOMER BRSHD ALUMN 3156PCS MBLE MINI SPKR-GRP BLK 2172PCS MBLE MINI SPKR-GRP BLK ARTS ELECTRONICS CO., LTD.,RM. 101 FO TAN IND. CTR., 26-28 AU PUI WAN ST., FO TAN, SHATIN, N.T. HONG KONG FOLDING TRAVEL CART ZHONGSHENG INDUSTRY CO,.LTD ZHISHAN INDUSTRY AREA,DUYUAN,JIANGMENG 529163, GUANGDONG,CHINA E1 COLORBUDSSHENZHEN VTSONIC CO.,LTD. NO.35, THE 2ND INDUSTRIAL ROAD, TANGXIAYONG VILLAGE, SONGGANG TOWN, BAO AN DISTRICT, SHENZHEN.PRC WALL CHARGER W TIPS 2.1A HONINN TECHNOLOGY CO., LTD. NO.2 LANE 222, MINZU RD., BANCIAO, TAIPEI, TAIWANIPAD2 ANTI-GLARE SCREEN PROTECTOR IPAD MINI ANTI-GLARE SCREEN PROTECTOR IPAD MINI ANTI-GLARE SCREEN PROTECTOR JIANGMEN VIPO ELECTRONIC TECHNOLOGY CO., LTD. NO.110, BUILDING 2, WENMING DISTRICT, WENCHANG GARDEN, LILE, JIANGMEN CITY, GUANGDONG  CHINA S/C US0000119N/A N/A N/A N/A N/A N/A N/A N/AN/A N/A N/A N/A N/A N/A N/A N/AN/A N/A N/A N/A N/A N/A N/A N/AN/A N/A N/A N/A N/A N/A N/A N/AN/A N/A N/A  GLDU5150581 ","GLDU5150581 GLDU5150581 GLDU5150581 GLDU5150581 GLDU5150581 GLDU5150581 GLDU5150581 GLDU5150581 GLDU5150581 ","2041  PKGDUAL GROOMER BRSHD ALUMN3156PCSMBLE MINI SPKR-GRP BLK2172PCSMBLE MINI SPKR-GRP BLKARTS ELECTRONICS CO., LTD.,RM. 101 FO TAN IND. CTR., 26-28 AU PUI WAN ST., FO TAN, SHATIN, N.T. HONG KONGFOLDING TRAVEL CARTZHONGSHENG INDUSTRY CO,.LTDZHISHAN INDUSTRY AREA,DUYUAN,JIANGMENG529163,GUANGDONG,CHINAE1 COLORBUDSSHENZHEN VTSONIC CO.,LTD. NO.35, THE 2ND INDUSTRIAL ROAD, TANGXIAYONGVILLAGE, SONGGANG TOWN,BAO AN DISTRICT, SHENZHEN.PRCWALL CHARGER W TIPS 2.1AHONINN TECHNOLOGY CO., LTD.NO.2 LANE 222, MINZU RD., BANCIAO, TAIPEI,TAIWANIPAD2 ANTI-GLARE SCREEN PROTECTOR IPAD MINI ANTI-GLARE SCREEN PROTECTORIPAD MINI ANTI-GLARE SCREEN PROTECTORJIANGMEN VIPO ELECTRONIC TECHNOLOGY CO., LTD.NO.110, BUILDING 2, WENMING DISTRICT,WENCHANG GARDEN, LILE,JIANGMEN CITY, GUANGDONG  CHINAS/C US0000119N/A N/AN/AN/AN/AN/AN/AN/AN/A N/AN/AN/AN/AN/AN/AN/AN/A N/AN/AN/AN/AN/AN/AN/AN/A N/AN/AN/AN/AN/AN/AN/AN/A N/AN/A ","","YANTIAN CY"
"HONG JIN ZI XUN FU WU BU","NO.108, SI YOU XIN MA ROAD, YUEXIU|DISTRICT,GUANGZHOU CITY,GUANGDONG P|ROVINCE,CHINA","YESCOM USA INC.","185 N.SUNSET AVE. CITY OF INDUSTRY|CA 91744 USA|","YESCOM USA INC.","185 N.SUNSET AVE. CITY OF INDUSTRY|CA 91744 USA|","ORDER","","13853","KG","52","X","871","","ATXF","YM SHANGHAI","068E","ATXFAASU13030350","9157650","PEOPLES REP OF CHINA","LOS ANGELES","SHANGHAI","","04/01/2013","KKFU1592113 ","871 ","HUNTING TENT WITH CHAIR  KKFU1592113 ","KKFU1592113 ","NO MARKS ","","SHANGHAI"
"ORDER","","ORDER","","ORDER","","ORDER","","2979","KG","0","","148","GLOBAL LINK LOGISTICS","GLLG","COSCO DALIAN","084E","GLLGTJEF13030002","9300312","PEOPLES REP OF CHINA","LONG BEACH","HSINKANG","","04/01/2013","KKFU1633249  ","148  ","PATIO FURNITURE AS PER  P.O.NO.1113 WE H EREBY CONFIRM THAT THE ABOVE SHIPMENT CO NTAINS NO SOLID WOOD PACKING MATERIALS . .  KKFU1633249 ","KKFU1633249 ","AGIO INTERNATIONAL 2013 VALUE PROGRAM P.O.NUMBER: ITEM NUMBER: SKU NUMBER: DESCRIPTION: FRAME:# FABRIC: QUANTITY PER CARTON: CARTON NUMBER: N.W.:  LBS  KGS G.W.;  LBS KGS MEAS.:INCH MADE IN CHINA ","","XINGANG"
"ORDER","","ORDER","","ORDER","","ORDER","","4576","KG","55","X","460","MOHAWK CUSTOMS AND SHIPPING CO INC","MHCK","COSCO DALIAN","084E","MHCKTSN3020029","9300312","PEOPLES REP OF CHINA","LONG BEACH","HSINKANG","","04/01/2013","KKFU1778284 ","460 ","SLEEPING BAGS PONUM962160  KKFU1778284 ","KKFU1778284 ","NO MARKSNO MARKS ","","XINGANG, CHINA"
"RAOYANG COUNTY JIAYE HANDICRAFT CO","NO.633 SUHENG ROAD,RAOYANG TOWN,|RAOYANG COUNTY,HENGSHUI,HEBEI,|CHINA","SANTA BARBARA CERAMIC DESIGN","1600 PACIFIC AVENUE OXNARD,|CALIFORNIA 93033|","SANTA BARBARA CERAMIC DESIGN","1600 PACIFIC AVENUE OXNARD,|CALIFORNIA 93033|","ORDER","","6953","KG","64","CM","1194","ORIENT EXPRESS CONTAINER CO INC","OERT","COSCO DALIAN","0084E","OERT204701C00243","9300312","PEOPLES REP OF CHINA","LONG BEACH","HSINKANG","","04/01/2013","TCLU8239406  ","1194  ","WINE GLASS  THIS SHIPMENT DOES NOT CONTAIN AN Y SOLID WOOD PACKING MATERIAL  CY/DOOR  TCLU8239406 ","TCLU8239406 ","N/M ","","TIANJIN"
"ORDER","","ORDER","","ORDER","","ORDER","","8496","KG","0","","7080","UPS SCS (ASIA) LTD","UASI","COSCO DALIAN","084E","UASI7781161916","9300312","PEOPLES REP OF CHINA","LONG BEACH","TIANJIN","","04/01/2013","KKFU1259015 KKFU1798022 ","3500 3580 ","MEN'S 100%WOOL WOVEN SPORTCOAT  KKFU1259015 MEN'S 100%WOOL WOVEN SPORTCOAT  KKFU1798022 ","KKFU1259015 KKFU1798022 ","N/M N/M ","","XINGANG,CN"
"ORDER","","ORDER","","ORDER","","ORDER","","17150","KG","70","X","700","K LINE","KKLU","COSCO DALIAN","084E","KKLUTSN268371","9300312","PEOPLES REP OF CHINA","LONG BEACH","HSINKANG","","04/01/2013","BSIU9373487  ","700  ","MOVERS BLANKET P O NO. 35819-6053278 SKU 6950 4 S C RIC0010201 THIS SHIPMENT CONTAINS NO WO ODEN PACKING MATERIALS  BSIU9373487 ","BSIU9373487 ","SKU  P.O.  MORENO VALLEY,CA C NO.  MADE IN CHINANA ","","XINGANG,CHINA"
"CHINA ABRASIVES IMPORT & EXPORT COR","PORATION 183 ZHONGYUAN WEST ROAD,|ZHENGZHOU, CHINA|ZHENGZHOU 450006 CHINA","FOSECO(DIVISION OF VESUVIUS USA","20200 SHELDON ROAD|CLEVELAND|OH 44142 UNITED STATES","FOSECO(DIVISION OF VESUVIUS USA","20200 SHELDON ROAD|CLEVELAND|OH 44142 UNITED STATES","ORDER","","19030","KG","0","","20","SEAQUEST LINE","SQST","COSCO DALIAN","084E","SQSTTSN0023593","COSCO D","PEOPLES REP OF CHINA","LOS ANGELES","HSINKANG","","04/01/2013","KKTU7864698 ","20 ","GREEN SILICON CARBIDE(NON HAZARDOUS)  KKTU7864698 ","KKTU7864698 ","N/MUNIT/SEAL NUMBEKKTU7864698MAB22931 ","","HSINKANG; XINGANG"
"ORDER","","NAVISTAR INC","4201 WINFIELD ROAD|WARRENVILLE|IL 60555 UNITED STATES","ORDER","","ORDER","","76000","KG","0","","96","SEAQUEST LINE","SQST","COSCO DALIAN","084E","SQSTTSN0023607","COSCO D","PEOPLES REP OF CHINA","LOS ANGELES","HSINKANG","","04/01/2013","GLDU9669533 KKTU7670809 KKTU7703733 TCLU3391740 ","24 24 24 24 ","BRAKE DRUM  GLDU9669533 BRAKE DRUM  KKTU7670809 BRAKE DRUM  KKTU7703733 BRAKE DRUM  TCLU3391740 ","GLDU9669533 GLDU9669533 GLDU9669533 GLDU9669533 GLDU9669533 KKTU7670809 KKTU7670809 KKTU7670809 KKTU7670809 KKTU7670809 KKTU7703733 KKTU7703733 KKTU7703733 KKTU7703733 KKTU7703733 TCLU3391740 TCLU3391740 TCLU3391740 TCLU3391740 TCLU3391740 ","C13LSNA058UNIT/SEAL NUMBEKKTU7670809MAB23774TCLU3391740MAB55915KKTU7703733MAG30494 GLDU9669533MAG30409C13LSNA058UNIT/SEAL NUMBEKKTU7670809MAB23774TCLU3391740MAB55915 KKTU7703733MAG30494GLDU9669533MAG30409C13LSNA058UNIT/SEAL NUMBEKKTU7670809MAB23774 TCLU3391740MAB55915KKTU7703733MAG30494GLDU9669533MAG30409C13LSNA058UNIT/SEAL NUMBE KKTU7670809MAB23774TCLU3391740MAB55915KKTU7703733MAG30494GLDU9669533MAG30409 C13LSNA058UNIT/SEAL NUMBEKKTU7670809MAB23774TCLU3391740MAB55915KKTU7703733MAG30494 GLDU9669533MAG30409C13LSNA058UNIT/SEAL NUMBEKKTU7670809MAB23774TCLU3391740MAB55915 KKTU7703733MAG30494GLDU9669533MAG30409C13LSNA058UNIT/SEAL NUMBEKKTU7670809MAB23774 TCLU3391740MAB55915KKTU7703733MAG30494GLDU9669533MAG30409C13LSNA058UNIT/SEAL NUMBE KKTU7670809MAB23774TCLU3391740MAB55915KKTU7703733MAG30494GLDU9669533MAG30409 C13LSNA058UNIT/SEAL NUMBEKKTU7670809MAB23774TCLU3391740MAB55915KKTU7703733MAG30494 GLDU9669533MAG30409C13LSNA058UNIT/SEAL NUMBEKKTU7670809MAB23774TCLU3391740MAB55915 KKTU7703733MAG30494GLDU9669533MAG30409C13LSNA058UNIT/SEAL NUMBEKKTU7670809MAB23774 TCLU3391740MAB55915KKTU7703733MAG30494GLDU9669533MAG30409C13LSNA058UNIT/SEAL NUMBE KKTU7670809MAB23774TCLU3391740MAB55915KKTU7703733MAG30494GLDU9669533MAG30409 C13LSNA058UNIT/SEAL NUMBEKKTU7670809MAB23774TCLU3391740MAB55915KKTU7703733MAG30494 GLDU9669533MAG30409C13LSNA058UNIT/SEAL NUMBEKKTU7670809MAB23774TCLU3391740MAB55915 KKTU7703733MAG30494GLDU9669533MAG30409C13LSNA058UNIT/SEAL NUMBEKKTU7670809MAB23774 TCLU3391740MAB55915KKTU7703733MAG30494GLDU9669533MAG30409C13LSNA058UNIT/SEAL NUMBE KKTU7670809MAB23774TCLU3391740MAB55915KKTU7703733MAG30494GLDU9669533MAG30409 ","","HSINKANG; XINGANG"
"ORDER","","ORDER","","ORDER","","ORDER","","17200","KG","16","CM","810","ORIENT EXPRESS CONTAINER CO INC","OERT","COSCO DALIAN","0084E","OERT204715C00015","9300312","PEOPLES REP OF CHINA","LONG BEACH","HSINKANG","","04/01/2013","KKTU7814320   ","810   ","GLASS BEADS 80 GRIT  ""THIS SHIPMENT DOES NOT CONTAIN ANY SOLID WOOD PACKING MATERIAL""  Als o Notify justin.delafuente@expeditors.com mic hael.rieger@buffalotools.com CY/CY  KKTU7814320 ","KKTU7814320 ","PO#23987 ","","TIANJIN"
"CHUNG TIN GROUP HOLDING LIMITED","FURONG INDUSTRIAL ZONE HAOST|XINQIAO VILLAGE SHAJING TOWN|SHENZHEN, CHINA","AVERY DENNISON (MA)","OFFICE PRODUCTS CO.|ONE BETTER WAY|CHICOPEE, MA 01022 USA","ORDER","","ORDER","","57578","KG","152","CM","119","PANTAINER EXPRES LINE PANALPINA INC","PNEP","CSCL NEW YORK","I097E","PNEP13556771310","CSCL NE","PEOPLES REP OF CHINA","NEW YORK","YANTIAN","","04/01/2013","ECMU9732020 GESU4373780 INKU2648545    ","41 39 39    ","PP FLAT HTS CODE : 3926.90.9980 41PKGS WITHIN 41PLTS  ECMU9732020 PP FLAT HTS CODE : 3926.90.9980 39PKGS WITHIN 39PLTS  GESU4373780 PP FLAT HTS CODE : 3926.90.9980 39PKGS WITHIN 39PLTS THIS SHIPMENT NO SOLID WOOD PACKING EXPORT REF:TB01446332 TOTAL SAY 3X40HQCONTAINERS (119PKGS) ONLY null EMAIL:MARISELA.ORDAZ@ EXPEDITORS.COM ALSO NOTIFY PARTY: AVERY DENNISON 50 POINTE DRIVEBREA CA 92821 USA  INKU2648545 ","ECMU9732020 GESU4373780 INKU2648545 ","HBLMLCWHKGH10007648AVERY HBLMLCWHKGH10007648AVERY HBLMLCWHKGH10007648AVERY ","","YANTIAN"
"HUIZHOU ZHONGJI FURNITURE MFY LTD","EAST INDUSTRY PARK YONGSHI ROAD|BOLUO CITY|5196127","IKEA DISTRIBUTION SERVICES INC. W","100 IKEA DRIVE|WESTAMPTON|08060","IKEA DISTRIBUTION SERVICES INC.","100 IKEA DRIVE|WESTHAMPTON|08060","ORDER","","6761","KG","58","CM","92","CMA-CGM","CMDU","CSCL NEW YORK","BI098","CMDUSHZ1434030","9290115","PEOPLES REP OF CHINA","NEW YORK","YANTIAN","","04/01/2013","CLHU8567796    ","92    ","IKEA HOME FURNISHING PRODUCTS SHIPMENT ID: 012-TSO-S566609 CONSIGNMENT: 16023-SUP-ECIS171 42 COMMODITY NUMBER 1 CUSTOMS TARIFF NUMBER=  940161 SECOND NOTIFY:OHL INT THE NAVY YAR D 5101 SOUTH BROAD STR EET PHILADELPHIA 191 12 US US 19112 FREIGHT COLLECT  CLHU8567796 ","CLHU8567796 ","N/M ","","YANTIAN"
"HAYWARD INDUSTRIES (WUXI) CO., LTD.","BLOCK K4-A, EXPORT PROCESSING|ZONE, WUXI NEW DISTRICT|WUXI, JIANGSU 214028             CN","HAYWARD INDUSTRIES, INC.","1 HAYWARD INDUSTRIAL DRIVE|CLEMMONS NC 27012                US|","ORDER","","ORDER","","16018","KG","118","CM","1732","EXPEDITORS INTERNATIONAL OF WASHINGTON","EXDO","HANJIN NAGOYA","00093","EXDO6394735781","9155028","PEOPLES REP OF CHINA","WILMINGTON NC","SHANGHAI","","04/01/2013","KKFU1174598 KKFU1426426 ","1101 631 ","SWIMMING POOL ACCESSOIRES  KKFU1174598 SWIMMING POOL ACCESSOIRES  KKFU1426426 ","KKFU1174598 KKFU1426426 ","NO MARKS NO MARKS ","","WUXI"
"GOLDCREDIT INTERNATIONAL","ENTERPRISES 151 NO.LAKEBANK ELEGANT|GARDEN WEST JINGCHENG ROAD|WUXI, ZHEJIANG                   CN","Elmer' S Products, Inc.","1559 Fau Cette Road|Burlington NC 27215              US|","ORDER","","ORDER","","79309","KG","321","CM","26224","EXPEDITORS INTERNATIONAL OF WASHINGTON","EXDO","HANJIN NAGOYA","00093","EXDO6394735854","9155028","PEOPLES REP OF CHINA","WILMINGTON NC","SHANGHAI","","04/01/2013","CAIU8475766 KKFU7112150 KKFU7230810 KKFU7475006 TCKU9757871 ","6450 4546 3842 4936 6450 ","GLUE STICK  CAIU8475766 GLUE STICK  KKFU7112150 GLUE STICK  KKFU7230810 GLUE STICK  KKFU7475006 GLUE STICK  TCKU9757871 ","CAIU8475766 KKFU7112150 KKFU7230810 KKFU7475006 TCKU9757871 ","NO MARKS NO MARKS NO MARKS NO MARKS NO MARKS ","","SHANGHAI"
"NANTONG HAIDI CHEMICALS CO.,LTD","TANGJIA TOWN WEST HAIMEN|JIANGSU,CHINA|TEL:0513-82221955","SUN CHEMICAL CORPORATION","5020 SPRING GROVE AVENUE|CINCINNATI,OHIO 45232 U.S.A|ATTN:CATHY ELLIOTT","(1)BDP INTERNATIONAL INC.","1810 AIRPORT EXCHANGE BLVD.|ERLANGER,KENTUCKY 41018|PHONE:859.488.0676","ORDER","","10199.94","KG","50","CM","40","MAERSK LINE","MAEU","AXEL MAERSK","789S","MAEU588044296","9260419","PEOPLES REP OF CHINA","CHARLESTON","SHANGHAI","","04/01/2013","PONU1881392       ","40       ","DINAIL(2,5-DICHLORO-3,6-BIS  ( 9-ETYL-3-CARBAZOLYLAMINO)-1,4- BENZ  OQUINONE)  ZIP CODE:2971 5  PO# 4500881355  S/C#630409 SAY FORTY BAGS ONLY.  MARKS A ND NOS:  PO# 4500881355  ITEM# :30504220  DIANIL  LOT NO.:  N.W.:  G.W.:  MADE IN CHINA  *E MAIL:DANIEL.NOLAN@BDPINTERNATI ONAL.COM      SHIPPER DECLARES THE CARGO TO BE (MADE IN CHIN A). THIS DECLARATION, INCLUDIN G OTHER CARGO DETAILS HAS NOT BEEN VERIFIED BY OR FOR THE CA RRIER WHO SHALL BE WITHOUT ANYRESPONSIBILITY FOR ITS CORREC TNESS AS PER CLAUSE 14.2 HER EOF  PONU1881392 ","PONU1881392 ","(2)SUN CHEMICAL CORP.  NATIONA FORD.,SC 2300 BANKS STREE6T FORT MILL SC29715-8400  UNITED STATES OF AMERICA ","","SHANGHAI"
"KELON INTERNATIONAL INC.",".|RM 3101-3105, SINGGA COMMERCIAL|CENTRE,NO 148 CONNAUGHT ROAD WEST,","ELECTROLUX MAJOR APPLIANCES",".|25 KEYSTONE BLVD POTTSVILLE,|PA 17901 PH: 570-544-1490","SAME AS CONSIGNEE",".|.|.","ORDER","","19596","KG","0","","426","HANJIN SHIPPING COMPANY LTD","HJSC","YM PORTLAND","0047E","HJSCCAN303933600","9236535","PEOPLES REP OF CHINA","SAVANNAH","HONG KONG","","04/01/2013","HJCU1351466 HJCU1916006 HJCU1977125 ","142 142 142 ","FREEZER  HJCU1351466 FREEZER  HJCU1916006 FREEZER  HJCU1977125 ","HJCU1351466 HJCU1916006 HJCU1977125 ","N/M N/M N/M ","","RONGQI,GUANGDONG"
"ORDER","","HD SUPPLY FACILITIES MAINTENANCE, L","10641 SCRIPPS SUMMIT COURT|SAN DIEGO, CA 92131|858-831-2320, 858-831-2430","ORDER","","ORDER","","11535","KG","76","X","1426","MOL","MOLU","MOL MOTIVATOR","014E","MOLU13007551716","9475624","PEOPLES REP OF CHINA","LOS ANGELES","YANTIAN","","04/01/2013","MOEU0507861    ","1426    ","1426  CTN DEVIN GOVER CEILING FANS AND PARTS AS PER  PO 4700982734 ACCORDING TO SHIPPER, ""THIS SHIPMENT CONTAINS NO WOOD PKING MATERIALS.""CARRIER HAS NOT VERIFIED THIS INFORMATION.PLEASE REFER TO THE APPROPRIATE CERTIFICATION FOR DETAILS. S/C US00000T2  MOEU0507861 ","MOEU0507861 MOEU0507861 ","1426  CTNDEVIN GOVERCEILING FANS AND PARTS AS PER  PO4700982734ACCORDING TO SHIPPER,""THIS SHIPMENT CONTAINS NO WOODPKING MATERIALS.""CARRIER HAS NOT VERIFIED THIS INFORMATION.PLEASE REFER TO THEAPPROPRIATE CERTIFICATION FORDETAILS.S/C US00000T2 ","","YANTIAN CY"
"XIAMEN BOMA INTERNATIONAL TRADE","CO.,LTD.|14F-01 02,BAO TUO BUILDING,NO.617|SISHUI","MEGA GRANITE & MARBLE","360 MILLARD FARMER INDUSTRIAL|BLVD.,|NEWNAN, GA 30263","MEGA GRANITE & MARBLE","360 MILLARD FARMER INDUSTRIAL|BLVD.,|NEWNAN, GA 30263","ORDER","","17720","KG","0","","10","HECNY SHIPPING LTD","HYSL","AXEL MAERSK","789S","HYSLNXMN13020042","AXEL MA","PEOPLES REP OF CHINA","CHARLESTON","SHANGHAI","","04/01/2013","POCU0611383 ","10 ","GRANITE PRODUCT(COUNTER TOP)  POCU0611383 ","POCU0611383 ","MGM BMMGM-1206-3 ","","XIAMEN"
"XIAMEN BOMA INTERNATIONAL TRADE","CO.,LTD.|14F-01 02,BAO TUO BUILDING,NO.617|SISHUI","MEGA GRANITE & MARBLE","360 MILLARD FARMER INDUSTRIAL|BLVD.,|NEWNAN, GA 30263","MEGA GRANITE & MARBLE","360 MILLARD FARMER INDUSTRIAL|BLVD.,|NEWNAN, GA 30263","ORDER","","17220","KG","0","","9","HECNY SHIPPING LTD","HYSL","AXEL MAERSK","789S","HYSLNXMN13020043","AXEL MA","PEOPLES REP OF CHINA","CHARLESTON","SHANGHAI","","04/01/2013","PONU0413186 ","9 ","GRANITE PRODUCT(COUNTER TOP)  PONU0413186 ","PONU0413186 ","MGM BMMGM-1206-4 ","","XIAMEN"
"XIAMEN BOMA INTERNATIONAL TRADE","CO.,LTD.|14F-01 02,BAO TUO BUILDING,NO.617|SISHUI","MEGA GRANITE & MARBLE","360 MILLARD FARMER INDUSTRIAL|BLVD.,|NEWNAN, GA 30263","MEGA GRANITE & MARBLE","360 MILLARD FARMER INDUSTRIAL|BLVD.,|NEWNAN, GA 30263","ORDER","","16340","KG","0","","9","HECNY SHIPPING LTD","HYSL","AXEL MAERSK","789S","HYSLNXMN13020044","AXEL MA","PEOPLES REP OF CHINA","CHARLESTON","SHANGHAI","","04/01/2013","MSKU7882077 ","9 ","GRANITE PRODUCT(COUNTER TOP)  MSKU7882077 ","MSKU7882077 ","MGM BMMGM-1206-5 ","","XIAMEN"
"THULE ORGANIZATION SOLUTIONS ASIA","PACIFIC LTD SUITE 783, 7/F HONG KON|INT'L TRADE & EXHIBITION CENTRE,|1 TRADEMART DRIVE,KOWLOON BAY, HK","PHILIPS RESPIRONICS","312 ALVIN DR|NEW KENSINGTON|USA, PA 15608","EXPEDITORS INTL OF WA INC","980 BEAVER GRADE RD.|SUITE# 201|CORAOPOLIS PA 15108 U.S.A.","ORDER","","5151.91","KG","65","CM","575","MAERSK LINE","MAEU","CMA CGM ATTILA","793S","MAEU559397369","9433793","PEOPLES REP OF CHINA","NEW YORK","YANTIAN","","04/01/2013","MSKU9579389      ","575      ","Q-SERIES BAG   PO NO.: 4500800 046   ITEM NO.:30 2283032V01 SHIPPER PROVIDED HS CODE#4202 9260   Q SERIES BAG       FF= 5910227036   MSKU9579389/4400/ 575/CT/CY/CY/5152/KGM/65.79/MT Q/559397367    SHIPPER DECLARES THE CARGO TO BE (COUNTRY OF ORIGIN:CHINA). THIS DECLARATIO N, INCLUDING OTHER CARGO DETAI LS HAS NOT BEEN VERIFIED BY OR FOR THE CARRIER WHO SHALL BE WITHOUT ANY RESPONSIBILITY FOR ITS CORRECTNESS AS PER CLAU SE 14.2 HEREOF  MSKU9579389 ","MSKU9579389 MSKU9579389 ","EI REF:S913425968  SHIP REF: 5910227036  ITEM 30-2283032V01  QTY  PRODUCT:  RESPIRONICS  Q-SERIES CA  RESPIRONICS  P/N:1057531  REV#7   PO#:4500800046  LOT#213  COUNTRY OF ORIGIN:  CHINA  SUPPLIER:THULE ORG  SOLUTIONS ASIA  PACIFIC LTD  BOX: 1 OF 575DATE:2/28/2013  DELIVERY ADDRESS: RESPIRONICS INC  312 ALVIN DR  NEWKENSIGNTON,  PA 15608 ","","YANTIAN"
"PHILIPS ELECTRONICS HONG KONG","LIMITED UNIT 231-233, 2/F, CORE|BUILDING 2, 1 SCIENCE PARK WEST|AVENUE, HONG KONG SCIENCE PARK","PHILIPS RESPIRONICS","1592 ROSEYTOWN ROAD|GREENSBURG PA15601|USA","EXPEDITORS INTL OF WA INC","980 BEAVER GRADE RD.|SUITE# 201|CORAOPOLIS PA 15108 U.S.A.","ORDER","","5161.89","KG","65","CM","1177","MAERSK LINE","MAEU","CMA CGM ATTILA","793S","MAEU559397378","9433793","PEOPLES REP OF CHINA","NEW YORK","YANTIAN","","04/01/2013","MRKU4437179     ","1177     ","PLASTICS BREATHING MASK COMPON ENTS   RE: RIUS-11095 (RIYW) COMPENENTS: FOR MANUFACTURE PROCESSING OR REPACKAGING PLASTICS BREATHING MASK COMPO NENTS       FF=5910226997   FR EIGHT COLLECT, SHIPPER LOAD &COUNT   MRKU443717944001177CTC Y/CY5161.99KGM65.28MTQ55939737 8    SO: 559397378  MBL: MAEU5 59397378  **ISSUE SWB**  **FRE IGHT AND AMS COLLECT**  MRKU4437179 ","MRKU4437179 ","EI REF:S913425453  SHIP REF: 5910226997  PHILIPS  RESPIRONICS  1592 ROSEYTOWN  ROAD  GREENSBURG  PA15601USA  C/NO.1-1177   HS CODE:901920  HS CODE OF 582073:  3917.33.0000 ","","YANTIAN"
"WEAR YOUNG ENTERPRISE CO.,LTD.","10TH FLOOR,#20,SEC.1,HO PING WEST|ROAD,TAIPEI,TAIWAN|","ANNIE'S PUBLISHING LLC-STRATEGIC","FULFILLMENT GROP|111 CORPORATE DRIVE BIG SANDY,|TX 75755","ANNIE'S PUBLISHING LLC-STRATEGIC","FULFILLMENT GROP|111 CORPORATE DRIVE BIG SANDY,|TX 75755","ORDER","","1050","KG","3","CM","70","AMASS INTERNATIONAL GROUP","AMIG","MOL MOTIVATOR","014E","AMIG303L304112","9475624","PEOPLES REP OF CHINA","LOS ANGELES","YANTIAN","","04/01/2013","CRLU1625400  ","70  ","MERCHANDISE UNDER P.O.NO.242170 #145100 11""BOOK ORGANIZERS,SET OF 48 THIS SHIPMENT CONTAINS NO SOLID WOOD PACKING MATERIALS  CRLU1625400 ","CRLU1625400 ","ANNIE'SP.O.NO.2 42170ANNIE'S#1 4510011"" BOOK ORGANIZERS, SET OF48Q'TY :7 2 SETSC/NO. 1-7 0MADE IN CHINA ","","SHENZHEN"
"ACE-TEC CO.,LIMITED","YANG WU DISTRICT,DA LANG TOWN,|DONG GUAN,GUANG DONG,CHINA|","CONCEPT LABS","1400 WEST WABANSIA AVE,CHICAGO IL|60642|","PREVAL","465 CONGRESS ST,THIRD FLOOR,|PORTLAND,ME 04101|","ORDER","","1072","KG","5","CM","70","AMASS INTERNATIONAL GROUP","AMIG","MOL MOTIVATOR","014E","AMIG303L304462","9475624","PEOPLES REP OF CHINA","LOS ANGELES","YANTIAN","","04/01/2013","CRLU1625400  ","70  ","DEMOMATIC MICRODERMABRASION TATTOO DEVICE THIS SHIPMENT CONTAINS NO SOLID WOOD PACKING MATERIALS  CRLU1625400 ","CRLU1625400 ","PREVALUSAC/NO.:MADE IN CHINA ","","SHENZHEN"
"SHIPPER:ZHUONING CRAFT&GIFT FACTORY","#208B,MIDDLE RONGGUI AV,FOSHAN|CITY,GUANGDONG PROVINCE,CHINA|","PROTOVISION DISPLAYS LLC.","1542 N.51ST STREET,MILWAUKEE,|WI 53208,USA|","PROTOVISION DISPLAYS LLC.","1542 N.51ST STREET,MILWAUKEE,|WI 53208,USA|","ORDER","","940","KG","2","CM","100","AMASS INTERNATIONAL GROUP","AMIG","MOL MOTIVATOR","014E","AMIG303L304508","9475624","PEOPLES REP OF CHINA","LOS ANGELES","YANTIAN","","04/01/2013","CRLU1625400 ","100 ","PVC MAT THIS SHIPMENT CONTAINS NO SOLID WOOD PACKING MATERIALS  CRLU1625400 ","CRLU1625400 ","PAULANER HP USARAIL MATTOTAL UNITSQTY:BOXWWW.PROTOVISIONDISPLAYS.COM ","","SHENZHEN"
"HUIZHOU CHOPCHOP WOODSHOP CO.,LTD.","BAISHI VILLAGE,QIUCHANG TOWN,|HUIYANG CITY GUANGDONG|PROVINCE,CHINA","OSAKA ENTERPRISES,INC","225 SOUTH AVIATION BLVD,EL,SEGUNDO|CA 90245 USA|","NORMAN KRIEGER,INC.","921 WEST ARTESIA BLVD RANCHO|DOMINGUEZ,CA 90220|","ORDER","","2716","KG","11","CM","225","AMASS INTERNATIONAL GROUP","AMIG","MOL MOTIVATOR","014E","AMIG303L304532","9475624","PEOPLES REP OF CHINA","LOS ANGELES","YANTIAN","","04/01/2013","CRLU1625400  ","225  ","SKATEBOARD COMPLETES AND DECKS THIS SHIPMENT CONTAINS NO SOLID WOOD PACKING MATERIALS  CRLU1625400 ","CRLU1625400 ","PO.NO:CODE:DESCRIPTION:QTY: ","","SHENZHEN"
"ENTER ELECTRONICS CO.,LTD","4F,5BUILDING,DONGFANGMING|INDUSTRIAL PARK,NO.83,DA BAO|ROAD,BAOAN DISTRICT,SHENZHEN","ANIMA INTERNATIONAL","234 SOUTH 5TH AVE.CITY OF INDUSTRY|CA 91746|","ANIMA INTERNATIONAL","234 SOUTH 5TH AVE.CITY OF INDUSTRY|CA 91746|","ORDER","","384","KG","3","CM","48","AMASS INTERNATIONAL GROUP","AMIG","MOL MOTIVATOR","014E","AMIGSA33L50194","9475624","PEOPLES REP OF CHINA","LOS ANGELES","YANTIAN","","04/01/2013","CRLU1625400 ","48 ","MASSAGE INSOLE THIS SHIPMENT CONTAINS NO SOLID WOOD PACKING MATERIALS.  CRLU1625400 ","CRLU1625400 ","VIBRATHOTICS ","","SHENZHEN"
"CHINA NATIONAL AERO-TECHNOLOGY","GUANGZHOU COMPANY LIMITED|3/4F,SOUTH TOWER,POLYINTERNATIONAL|PLAZA,NO.1 EAST PAZHOU AVENUE,","FEBLO INTERNATIONAL LLC","34450 INDUSTRIAL RD LIVONIA,|MI 48151|","FEBLO INTERNATIONAL LLC","34450 INDUSTRIAL RD LIVONIA,|MI 48151|","ORDER","","1305","KG","10","CM","204","AMASS INTERNATIONAL GROUP","AMIG","MOL MOTIVATOR","014E","AMIGET33L61537","9475624","PEOPLES REP OF CHINA","LOS ANGELES","YANTIAN","","04/01/2013","CRLU1625400  ","204  ","WHEELCAP 1SH92SZOAB WHEELCAP 1SH92DD5AB WHEELCAP 1LB77DD5AB WHEELCAP 1LB77DX8AB THIS SHIPMENT CONTAINS NO SOLID WOOD PACKING MATERIALS  CRLU1625400 ","CRLU1625400 ","CUSTOMER:CHRYSLERPAR NO:Q'TY:DATE:SUPPLIER CODE:62497BMADE IN CHINA ","","SHENZHEN"
"DONGGUAN ZHANHONG WEAVING STRING","CO.LTD|XITAILONG INDUSTRIAL AREA,PEARL|ROAD,SHATIAN TOWN,DONGGUAN CITY,","INNOVATION SPECIALTIES,INC","11869 TEALE STREET,CULVER CITY,CA|90230,USA|","INNOVATION SPECIALTIES,INC","11869 TEALE STREET,CULVER CITY,CA|90230,USA|","ORDER","","1116","KG","8","CM","81","AMASS INTERNATIONAL GROUP","AMIG","MOL MOTIVATOR","014E","AMIGSA33L61586","9475624","PEOPLES REP OF CHINA","LOS ANGELES","YANTIAN","","04/01/2013","CRLU1625400  ","81  ","ELECTRONICS PARTS 100%POLYESTER LANYARD KEYCHAIN THIS SHIPMENT CONTAINS NO SOLID WOOD PACKING MATERIALS  CRLU1625400 ","CRLU1625400 CRLU1625400 ","PO#:C4500003555PART#TV MODEL#VERSION#ITEM NAMEQUANTITYI.S.IPO#:37987+38103 QTY:1000PCSMADE IN CHINAI.S.I.PO#ITEM#COLORPRODUCT DATEQTY ","","SHENZHEN"
"ORDER","","ORDER","","ORDER","","ORDER","","715","KG","6","CM","34","AMASS INTERNATIONAL GROUP","AMIG","MOL MOTIVATOR","014E","AMIGSA33L61589","9475624","PEOPLES REP OF CHINA","LOS ANGELES","YANTIAN","","04/01/2013","CRLU1625400 ","34 ","ELECTRONICS PARTS THIS SHIPMENT CONTAINS NO SOLID WOOD PACKING MATERIALS  CRLU1625400 ","CRLU1625400 ","PO#:C4500003555PART#TV MODEL#VERSION#ITEM NAMEQUANTITY ","","SHENZHEN"
"N EO UMBRELLA MFG.CO.","FLAT 02,31/F,HUNG CHAK HSE,|HUNG FUK COURT,TIN WAN, HK.|","DISCOUNT MARKETING PRODUCTS,INC","4060 PEACHTREE ROAD,SUITE D534,|ATLANTA GA 30319|","DISCOUNT MARKETING PRODUCTS,INC","4060 PEACHTREE ROAD,SUITE D534,|ATLANTA GA 30319|","ORDER","","376","KG","2","CM","21","AMASS INTERNATIONAL GROUP","AMIG","MOL MOTIVATOR","014E","AMIGGB33L61745","9475624","PEOPLES REP OF CHINA","LOS ANGELES","YANTIAN","","04/01/2013","CRLU1625400    ","21    ","3X3M ALUMINUM TENT FRAME 3X3M WHEEL BAG 3X3M WHEEL BAG 3X3M TENT TOP,600DX600D POYLYESTER FABRIC 3X3M TENT TOP,600DX600D POYLYESTER FABRIC 3M TENT SIDEWALL,600DX600D POLYESTER FABRIC THIS SHIPMENT CONTAINS NO SOLID WOOD PACKINGMATERIALS  CRLU1625400 ","CRLU1625400 ","DISCOUNT MARKETINGPRODUCTS, INC3X3M ALUMINUM TENTFRAME ","","SHENZHEN"
"TOP-WELL PACKAGING PRODUCTS CO.,LTD","NO.7 LONGTANG ROAD 2,THIRD INDUSTRY|DISTRICT,TANZHOU TOWN,|ZHONGSHAN CITY,GUANGDONG CHINA","INNOVATIVE COSMETIC CONCEPTS","1430 BROADWAY (4TH FLOOR),NEW YORK,|","INNOVATIVE COSMETIC CONCEPTS","1430 BROADWAY (4TH FLOOR),NEW YORK,|","ORDER","","4088","KG","15","CM","253","AMASS INTERNATIONAL GROUP","AMIG","MOL MOTIVATOR","014E","AMIGDMZ51320055","9475624","PEOPLES REP OF CHINA","LOS ANGELES","YANTIAN","","04/01/2013","CRLU1625400  ","253  ","CARDBOARD EMPTY PALETTE WITH CLEAR DUST COVER THIS SHIPMENT DOES NO CONTAIN ANY SOLID WOODE N PACKING MATERIALS  CRLU1625400 ","CRLU1625400 CRLU1625400 ","STILAIN THE LIGHT PALETTEITEM# S666010033PO#007335QUANTITY:160C NO OFMADE IN CHINASTILA IN THE LIGHT PALETTE DUST COVER ITEM#S666000081PO#007335QUANTITY:160C NO OFMADE IN CHINA ","","SHENZHEN"
