"GUOLI HEAVY MACHINERY","CO.,LTD|YUDI VILLAGE,TANGSHAN TOWN|HUANTAI COUNTRY, ZIBO CN","MITSUBISHI CATERPILLAR FORKLIFT","2121 WEST SAM HOUSTON PARKWAY NORTH|HOUSTON TX 77043 US|","ORDER","","ORDER","","159574","KG","1","X","111","BLUE ANCHOR LINE","BANQ","SEA-LAND COMET","1304","BANQTAO2349873","SEA-LAN","PEOPLES REP OF CHINA","LOS ANGELES","NINGPO","","04/01/2013","BMOU2315420     GLDU5453799     MRKU7269628     MRKU8579187     MRKU8664165     MRKU8664186     MRKU8665048     MRKU8665069     MRKU9070229     MSKU5487181     ","10     10     10     7     10     9     20     10     18     7     ","BALANCE WEIGHTS FOR COUNTER BALANCED FORKLIFT MBL#59029975 THIS SHIPMENT DOES CONTAIN NON-MANUFACTURED WOODEN MATERIAL,DUNNAGE,BRACING MATERIAL,PALLETS,CRATINGOR OTHER NON-MANUFACTURED WOODEN PACKING MATERIAL; AND ALSO THE WOODEN MATERIAL IS FUMIGATED. SCAC BANQ HB L TAO2349873 PLS SHOW CONTRACTUAL CUSTOMER AS BLUE ANCHOR LINE (MCFA)WHICH IS MAERSK CODE 33101026803  BMOU2315420 BALANCE WEIGHTS FOR COUNTER BALANCED FORKLIFT MBL#59029975 THIS SHIPMENT DOES CONTAIN NON-MANUFACTURED WOODEN MATERIAL,DUNNAGE,BRACING MATERIAL,PALLETS,CRATINGOR OTHER NON-MANUFACTURED WOODEN PACKING MATERIAL; AND ALSO THE WOODEN MATERIAL IS FUMIGATED. SCAC BANQ HB L TAO2349873 PLS SHOW CONTRACTUAL CUSTOMER AS BLUE ANCHOR LINE (MCFA)WHICH IS MAERSK CODE 33101026803  GLDU5453799 BALANCE WEIGHTS FOR COUNTER BALANCED FORKLIFT MBL#59029975 THIS SHIPMENT DOES CONTAIN NON-MANUFACTURED WOODEN MATERIAL,DUNNAGE,BRACING MATERIAL,PALLETS,CRATINGOR OTHER NON-MANUFACTURED WOODEN PACKING MATERIAL; AND ALSO THE WOODEN MATERIAL IS FUMIGATED. SCAC BANQ HB L TAO2349873 PLS SHOW CONTRACTUAL CUSTOMER AS BLUE ANCHOR LINE (MCFA)WHICH IS MAERSK CODE 33101026803  MRKU7269628 BALANCE WEIGHTS FOR COUNTER BALANCED FORKLIFT MBL#59029975 THIS SHIPMENT DOES CONTAIN NON-MANUFACTURED WOODEN MATERIAL,DUNNAGE,BRACING MATERIAL,PALLETS,CRATINGOR OTHER NON-MANUFACTURED WOODEN PACKING MATERIAL; AND ALSO THE WOODEN MATERIAL IS FUMIGATED. SCAC BANQ HB L TAO2349873 PLS SHOW CONTRACTUAL CUSTOMER AS BLUE ANCHOR LINE (MCFA)WHICH IS MAERSK CODE 33101026803  MRKU8579187 BALANCE WEIGHTS FOR COUNTER BALANCED FORKLIFT MBL#59029975 THIS SHIPMENT DOES CONTAIN NON-MANUFACTURED WOODEN MATERIAL,DUNNAGE,BRACING MATERIAL,PALLETS,CRATINGOR OTHER NON-MANUFACTURED WOODEN PACKING MATERIAL; AND ALSO THE WOODEN MATERIAL IS FUMIGATED. SCAC BANQ HB L TAO2349873 PLS SHOW CONTRACTUAL CUSTOMER AS BLUE ANCHOR LINE (MCFA)WHICH IS MAERSK CODE 33101026803  MRKU8664165 BALANCE WEIGHTS FOR COUNTER BALANCED FORKLIFT MBL#59029975 THIS SHIPMENT DOES CONTAIN NON-MANUFACTURED WOODEN MATERIAL,DUNNAGE,BRACING MATERIAL,PALLETS,CRATINGOR OTHER NON-MANUFACTURED WOODEN PACKING MATERIAL; AND ALSO THE WOODEN MATERIAL IS FUMIGATED. SCAC BANQ HB L TAO2349873 PLS SHOW CONTRACTUAL CUSTOMER AS BLUE ANCHOR LINE (MCFA)WHICH IS MAERSK CODE 33101026803  MRKU8664186 BALANCE WEIGHTS FOR COUNTER BALANCED FORKLIFT MBL#59029975 THIS SHIPMENT DOES CONTAIN NON-MANUFACTURED WOODEN MATERIAL,DUNNAGE,BRACING MATERIAL,PALLETS,CRATINGOR OTHER NON-MANUFACTURED WOODEN PACKING MATERIAL; AND ALSO THE WOODEN MATERIAL IS FUMIGATED. SCAC BANQ HB L TAO2349873 PLS SHOW CONTRACTUAL CUSTOMER AS BLUE ANCHOR LINE (MCFA)WHICH IS MAERSK CODE 33101026803  MRKU8665048 BALANCE WEIGHTS FOR COUNTER BALANCED FORKLIFT MBL#59029975 THIS SHIPMENT DOES CONTAIN NON-MANUFACTURED WOODEN MATERIAL,DUNNAGE,BRACING MATERIAL,PALLETS,CRATINGOR OTHER NON-MANUFACTURED WOODEN PACKING MATERIAL; AND ALSO THE WOODEN MATERIAL IS FUMIGATED. SCAC BANQ HB L TAO2349873 PLS SHOW CONTRACTUAL CUSTOMER AS BLUE ANCHOR LINE (MCFA)WHICH IS MAERSK CODE 33101026803  MRKU8665069 BALANCE WEIGHTS FOR COUNTER BALANCED FORKLIFT MBL#59029975 THIS SHIPMENT DOES CONTAIN NON-MANUFACTURED WOODEN MATERIAL,DUNNAGE,BRACING MATERIAL,PALLETS,CRATINGOR OTHER NON-MANUFACTURED WOODEN PACKING MATERIAL; AND ALSO THE WOODEN MATERIAL IS FUMIGATED. SCAC BANQ HB L TAO2349873 PLS SHOW CONTRACTUAL CUSTOMER AS BLUE ANCHOR LINE (MCFA)WHICH IS MAERSK CODE 33101026803  MRKU9070229 BALANCE WEIGHTS FOR COUNTER BALANCED FORKLIFT MBL#59029975 THIS SHIPMENT DOES CONTAIN NON-MANUFACTURED WOODEN MATERIAL,DUNNAGE,BRACING MATERIAL,PALLETS,CRATINGOR OTHER NON-MANUFACTURED WOODEN PACKING MATERIAL; AND ALSO THE WOODEN MATERIAL IS FUMIGATED. SCAC BANQ HB L TAO2349873 PLS SHOW CONTRACTUAL CUSTOMER AS BLUE ANCHOR LINE (MCFA)WHICH IS MAERSK CODE 33101026803  MSKU5487181 ","BMOU2315420 BMOU2315420 BMOU2315420 GLDU5453799 GLDU5453799 GLDU5453799 MRKU7269628 MRKU7269628 MRKU7269628 MRKU8579187 MRKU8579187 MRKU8579187 MRKU8664165 MRKU8664165 MRKU8664165 MRKU8664186 MRKU8664186 MRKU8664186 MRKU8665048 MRKU8665048 MRKU8665048 MRKU8665069 MRKU8665069 MRKU8665069 MRKU9070229 MRKU9070229 MRKU9070229 MSKU5487181 MSKU5487181 MSKU5487181 ","N MNO MARKSNO MARKSNO MARKSNO MARKSNO MARKSNO MARKSNO MARKS NO MARKSNO MARKSNO MARKSNO MARKSNO MARKSNO MARKSNO MARKSNO MARKS NO MARKS N MNO MARKSNO MARKSNO MARKSNO MARKSNO MARKSNO MARKSNO MARKS NO MARKSNO MARKSNO MARKSNO MARKSNO MARKSNO MARKSNO MARKSNO MARKS NO MARKS N MNO MARKSNO MARKSNO MARKSNO MARKSNO MARKSNO MARKSNO MARKS NO MARKSNO MARKSNO MARKSNO MARKSNO MARKSNO MARKSNO MARKSNO MARKS NO MARKS N MNO MARKSNO MARKSNO MARKSNO MARKSNO MARKSNO MARKSNO MARKS NO MARKSNO MARKSNO MARKSNO MARKSNO MARKSNO MARKSNO MARKSNO MARKS NO MARKS N MNO MARKSNO MARKSNO MARKSNO MARKSNO MARKSNO MARKSNO MARKS NO MARKSNO MARKSNO MARKSNO MARKSNO MARKSNO MARKSNO MARKSNO MARKS NO MARKS N MNO MARKSNO MARKSNO MARKSNO MARKSNO MARKSNO MARKSNO MARKS NO MARKSNO MARKSNO MARKSNO MARKSNO MARKSNO MARKSNO MARKSNO MARKS NO MARKS N MNO MARKSNO MARKSNO MARKSNO MARKSNO MARKSNO MARKSNO MARKS NO MARKSNO MARKSNO MARKSNO MARKSNO MARKSNO MARKSNO MARKSNO MARKS NO MARKS N MNO MARKSNO MARKSNO MARKSNO MARKSNO MARKSNO MARKSNO MARKS NO MARKSNO MARKSNO MARKSNO MARKSNO MARKSNO MARKSNO MARKSNO MARKS NO MARKS N MNO MARKSNO MARKSNO MARKSNO MARKSNO MARKSNO MARKSNO MARKS NO MARKSNO MARKSNO MARKSNO MARKSNO MARKSNO MARKSNO MARKSNO MARKS NO MARKS N MNO MARKSNO MARKSNO MARKSNO MARKSNO MARKSNO MARKSNO MARKS NO MARKSNO MARKSNO MARKSNO MARKSNO MARKSNO MARKSNO MARKSNO MARKS NO MARKS ","","QINGDAO"
"NANTONG HONGDA CASING CO LTD","NO 8 LIYU ROAD RUGAO JIANGSU PROV|INCE 226500 P R CHINA TEL 86 513 8|7277878 FAX 86 513 87277088","DCW CASING LLC","700 SOUTH FULTON AVENUE MOUNT VER|NON NEW YORK 10550 U S A TEL 914 6|68 9000 FAX 914 668 5744","DCW CASING LLC","700 SOUTH FULTON AVENUE MOUNT VER|NON NEW YORK 10550 U S A TEL 914 6|68 9000 FAX 914 668 5744","ORDER","","20700","KG","0","X","90","ORIENT STAR TRANSPORT INTL INC","OSTI","CSCL NEW YORK","0116E","OSTISHNYC1330015","CSCL NE","PEOPLES REP OF CHINA","NEW YORK","SHANGHAI","","04/01/2013","UACU8336133 ","90 ","SALTED HOG CASINGS .  UACU8336133 ","UACU8336133 ","HD13 CA02NO 133 222 ","","NANTONG"
"ORDER","","ORDER","","ORDER","","ORDER","","71301","KG","0","","348","CDS GROUP HOLDINGS LIMITED","CFHL","CSCL NEW YORK","0116E","CFHLSHA130000479","9290115","PEOPLES REP OF CHINA","NEW YORK","SHANGHAI","","04/01/2013","UACU3376895 UACU3397861 UACU3530927 UACU3643034 ","76 86 100 86 ","PVC SHEET PVC  UACU3376895 PVC SHEET PVC  UACU3397861 PVC SHEET PVC  UACU3530927 PVC SHEET PVC  UACU3643034 ","UACU3376895 UACU3397861 UACU3530927 UACU3643034 ","N M N M N M N M ","","SHANGHAI"
"SHENZHEN GOOLAN DIGITAL TECHNOLOGY","CO.,LTD BLOCK B,SHENGHENGJI INDUST|RY FUYUAN 1ST RD FUYONG BAO'AN SHEN|SHEN 518103,P.R.CHINA","SOUTHERN TELECOM INC.","14C 53RD STREET BROOKLYN. NY 11232|USA|","SOUTHERN TELECOM INC.","14C 53RD STREET BROOKLYN. NY 11232|USA|","ORDER","","3270","KG","0","","3000","HONOUR LANE SHIPPING LTD","HNLT","MOL MOTIVATOR","014E","HNLTSZA1303501AA","MOL MOT","PEOPLES REP OF CHINA","LOS ANGELES","YANTIAN","","04/01/2013","FCIU3869180  ","3000  ","MP4 PLAYER:8521909090 MP3 PLAYER:8519813900 THIS SHIPMENT CONTAINS NO SOLID WOOD PACKING MATERIALS . . . .. . . .  FCIU3869180 ","FCIU3869180 FCIU3869180 ","MODEL NO.:PMP120- 4PKWG TOTAL MASTERCARTON QTY:10PCS COLOR:PINKP.O.NO:7113WG G.W.:1.18KGS N.W.:0.8KGSMEAS: 32X11.3X17.8CM CUBE:0.23 CU.FTCARTON NO.: OF 3000 MADE IN CHINAMODEL NO:PMP80-4B KWG TOTALMASTER CARTON QTY:10PCS COLOR:BLACKP.O.NO.:7113WG G.W.:0.91KGS N.W.:0.73KGS MEAS :32X11.3X17.8CMCUBE:0.23CU.FT CARTON NO.: OF 2000MADE IN CHINA ","","YANTIAN"
"ORDER","","ORDER","","ORDER","","ORDER","","1837","KG","18","CM","167","AMERICAN PRESIDENT LINES","APLU","MOL MOTIVATOR","00014","APLU051229811","9475624","PEOPLES REP OF CHINA","LOS ANGELES","YANTIAN","","04/01/2013","APHU6489493 APZU4709729 ","84 83 ","ALUMINIUM COOKWARES  APHU6489493 ALUMINIUM COOKWARES  APZU4709729 ","APHU6489493 APHU6489493 APHU6489493 APHU6489493 APZU4709729 ","MACY-S HOMESTORE DC-SCS-AC-O SECAUCUSMACY-SLOGISTICSDC-SC500 MEADOWLANDSPARKWAYCITY -SECAUCUSSTATE NJZIP CODE -07094COUNTRY US PO# 5295519DEPT #873MUS PO#000002444-ODCARTON NOCOUNTRY OFORIGIN - CHINA MARKS AND NUMBERS WITH CONTAINER  APHU648949 ","","YANTIAN, PC"
"ORDER","","ORDER","","ORDER","","ORDER","","428","KG","3","CM","62","AMERICAN PRESIDENT LINES","APLU","MOL MOTIVATOR","00014","APLU051229819","9475624","PEOPLES REP OF CHINA","LOS ANGELES","YANTIAN","","04/01/2013","APZU4853058 ","62 ","ALUMINIUM COOKWARES  APZU4853058 ","APZU4853058 APZU4853058 APZU4853058 ","MACY-S HOMESTORE DC-CLS-AC-O MINOOKAMACY-SLOGISTICSDC-CL601 MIDPOINT RD.CITY -MINOOKASTATE ILZIP CODE -60447COUNTRY USPO# 6182495 DEPT # 873MUS PO#000002459-ODCARTON NO.COUNTRY OFORIGIN -CHINA ","","YANTIAN, PC"
"ORDER","","ORDER","","ORDER","","ORDER","","3250","KG","39","X","654","K LINE","KKLU","YM SHANGHAI","068E","KKLUSH5623800","9157650","PEOPLES REP OF CHINA","LOS ANGELES","SHANGHAI","","04/01/2013","KKFU7197749  ","654  ","QUILT,WOVEN,100 COTTON PART OF CARGO IN CONTA INER QUILT,WOVEN,100 COTTON QUILT,WOVEN,100 C OTTON  KKFU7197749 ","KKFU7197749 ","AS PER COMMERCIAL INVOICE AS PER COMMERCIAL INVOICE AS PER COMMERCIAL INVOICENA ","","SHANGHAI"
"ORDER","","ORDER","","ORDER","","ORDER","","839","KG","7","X","116","K LINE","KKLU","YM SHANGHAI","068E","KKLUSH5624043","9157650","PEOPLES REP OF CHINA","LOS ANGELES","SHANGHAI","","04/01/2013","TCNU8214215 ","116 ","QUILT AND SHAM PART OF CARGO IN CONTAINER QUI LT AND SHAM  TCNU8214215 ","TCNU8214215 ","AS PER COMMERCIAL INVOICE AS PER COMMERCIAL INVOICE ","","SHANGHAI"
"ORDER","","ORDER","","ORDER","","ORDER","","5064","KG","33","X","300","K LINE","KKLU","YM SHANGHAI","068E","KKLUSH5624047","9157650","PEOPLES REP OF CHINA","LOS ANGELES","SHANGHAI","","04/01/2013","KKFU9007961 ","300 ","QUILT SHAM PART OF CARGO IN CONTAINER QUILT S HAM QUILT SHAM  KKFU9007961 ","KKFU9007961 ","NANA ","","SHANGHAI"
"UNIQUE FAR EAST LTD.","UNITS 01-03 , LEVEL 22, TOWER 1,|MILLENNIUM CITY ONE,|388 KWUN TONG ROAD,","UNIQUE INDUSTRIES , INC.","225 TOY LANE|BLAIRS , VA , 24527|U.S.A.","UNIQUE INDUSTRIES, INC.","4750 LEAGUE ISLAND BLVD.|PHILADELPHIA, PA 19112-1222 USA|","ORDER","","63082","KG","203","CM","5110","AMERICAN PRESIDENT LINES","APLU","MOL PREMIUM","00075","APLU051289210","9444261","PEOPLES REP OF CHINA","NORFOLK","YANTIAN","","04/01/2013","APZU3020191 APZU4624093 DRYU4033047 GLDU3712360 TRLU9430118 ","1022 1022 1022 1022 1022 ","PLASTIC PARTY SUPPLIES ; THIS SHIPMENT CONTAINS NO WOOD PACKING MATERIALS  APZU3020191 PLASTIC PARTY SUPPLIES ; THIS SHIPMENT CONTAINS NO WOOD PACKING MATERIALS  APZU4624093 PLASTIC PARTY SUPPLIES ; THIS SHIPMENT CONTAINS NO WOOD PACKING MATERIALS  DRYU4033047 PLASTIC PARTY SUPPLIES ; THIS SHIPMENT CONTAINS NO WOOD PACKING MATERIALS  GLDU3712360 PLASTIC PARTY SUPPLIES ; THIS SHIPMENT CONTAINS NO WOOD PACKING MATERIALS  TRLU9430118 ","APZU3020191 APZU3020191 APZU3020191 APZU3020191 APZU4624093 DRYU4033047 GLDU3712360 TRLU9430118 ","U.          I.-98569 32;;;;;; ;;;;;;;; ;;;;;;;; ;;;; MARKS AND NUMBERS WITH CONTAINER  APZU302019 MARKS AND NUMBERS WITH CONTAINER  APZU302019 MARKS AND NUMBERS WITH CONTAINER  APZU302019 MARKS AND NUMBERS WITH CONTAINER  APZU302019 ","","YANTIAN, PC"
"FREEMAN MANUFACTORIES LTD.","3 F, BLK D, SHING LEE COMMERCIAL|BUILDING, 6-12 WING KUT STREET,|HONG KONG","AMERICAN HOTEL REGISTER COMPANY.","100 SOUTH MILWAUKEE AVENUE|VERNON HILLS, IL 60061|U.S.A.","THE CAMELOT COMPANY","9865 WEST LELAND AVENUE|SCHILLER PARK,ILLINOIS,|60176-1303 CHICAGO,U.S.A.","ORDER","","8789","KG","62","CM","1024","AMERICAN PRESIDENT LINES","APLU","MOL MOTIVATOR","00014","APLU051289377","9475624","PEOPLES REP OF CHINA","LOS ANGELES","YANTIAN","","04/01/2013","GESU5631739 ","1024 ","HOTEL AMENITIES DETAIL AS PER ATTACHED SHEET.  GESU5631739 ","GESU5631739 ","ASPERATTACHMENT ","","YANTIAN, PC"
"ORDER","","ORDER","","ORDER","","ORDER","","5575.56","KG","52","CM","136","MAERSK LINE","MAEU","CMA CGM ATTILA","793S","MAEU587137055","9433793","PEOPLES REP OF CHINA","NEW YORK","TANJUNG","","04/01/2013","GESU6003167 ","136 ","136 PACKAGES  2-TIER FOUNTAIN P.O. NO.: 54190537  GESU6003167 ","GESU6003167 ","209455  THD (IN TRI)  DEPT# 028  PURCHASE  ORDER#  54190537  DESCRIPTION:  2-TIER  FOUNTAIN  COUNTRY OF   ORIGIN: MADE  IN  1 209455 ","","XIAMEN"
"ORDER","","ORDER","","ORDER","","ORDER","","19044","KG","0","X","2920","ARGOS GROUP INC","AGOG","CSCL NEW YORK","0116E","AGOGHKGTEBD00411","CSCL NE","PEOPLES REP OF CHINA","NEW YORK","XIAMEN","","04/01/2013","UACU8371345  ","2920  ","ASSORTED HEALTH AND BEAUTY CARE (SKIN AND BODY LOTION) AS PER PO NO.2354 (PURCHASE ORDER NO.4027667) INCOTERMS 2010.DC NUMBER: TBA  UACU8371345 ","UACU8371345 ","N MNO MARKSNO MARKSNO MARKS ","","XIAMEN"
"QUANZHOU FUYANG TRADING CO.,LTD","CHENGBEI INDUSTRIAL AREA,LUOCHENG|TOWN,HUIAN,|","BEAUX MERZON INC.","1050 VALLEY BROOK AVENUE,|LYNDHURST, NEW JERSEY 07071, U.S.A.|","BEAUX MERZON INC.","1050 VALLEY BROOK AVENUE,|LYNDHURST, NEW JERSEY 07071, U.S.A.|","ORDER","","9701","KG","59","CM","1032","CDS GROUP HOLDINGS LIMITED","CFHL","CSCL NEW YORK","0116E","CFHLXMN130000113","9290115","PEOPLES REP OF CHINA","NEW YORK","XIAMEN","","04/01/2013","UACU8193541 ","1032 ","PAPER BOARD CORE 3 RING BINDER  UACU8193541 ","UACU8193541 ","CASE IT STYLE  DESCRIPTION  CASE PACK QTYPO CUSTOMER SKU  UPC DISPLAY GWKG ","","XIAMEN"
"DALIAN LUXE FOODS INTERNATIONAL","SALES CO., LIMITEDROOM 1206,WANDA B|UILDING,#18HONGDA ROAD,ZHONGSHANDIS|TRICT,DALIAN,CHINA","PORT ROYAL SALES LTD.","95 FROEHLICH FARM BLVD.,WOODBURY,NY|11797|","PORT ROYAL SALES LTD.","95 FROEHLICH FARM BLVD.,WOODBURY,NY|11797|","ORDER","","20060","KG","0","","1700","HONOUR LANE SHIPPING LTD","HNLT","CSCL NEW YORK","0116E","HNLTXMA1302268AA","CSCL NE","PEOPLES REP OF CHINA","NEW YORK","XIAMEN","","04/01/2013","UACU3348131  ","1700  ","CANNED SLICED CARROTS 425GX24TINS PO#71776 THIS SHIPMENT CONTAINS NO SOLID WOOD PACKING MATERIALS.  UACU3348131 ","UACU3348131 ","N MNO MARKSNO MARKS ","","XIAMEN"
"SHENZHEN YILAI MOLD&PLASTIC CO.,LTD","F1&F2, NO.15, SHAHE ROAD, DA WAN|DONG HAI INDUSTRY,DAKANG COMMUNITY|HENGGANG STREET,SHENZHEN,CHINA","HOURGLASS- KINGDOM ANIMALIA, LLC","1241 ELECTRIC AVE VENICE|CA 90291 USA|","HOURGLASS COSMETICS","8505 S. LA CIENEGA BOULEVARD|INGLEWOOD CA 90301 USA|","ORDER","","2015","KG","6","CM","146","AMASS INTERNATIONAL GROUP","AMIG","MOL MOTIVATOR","014E","AMIG303L304119","9475624","PEOPLES REP OF CHINA","LOS ANGELES","YANTIAN","","04/01/2013","HDMU6546855  ","146  ","FEMME NUDE LIP STYLO-CAP FEMME NUDE LIP STYLO- BASE THIS SHIPMENT CONTAINS NO SOLID WOOD PACKING MATERIALS  HDMU6546855 ","HDMU6546855 ","HCT PACKAGING, INC.CUSTOMER NAME:HOURGLASSCOSMETICSCUSTOMER PO#:7000000741ITEM NUMBER:NU-CP-01ITEM DESCRIPTION:FEMME NUDELIP STYLO- CAP ","","SHENZHEN"
"UNILIFT ENERTECH LTD.","34 GUANGFU N. RD., HSINCHU IND.|PARK,HUKOU,HSINCHU, TAIWAN 30351|","SUMMIT ESP, LLC","SUMMIT ESP, LLC TULSA HEADQUARTERS|835 WEST 41ST STREET SOUTH|TULSA, OK 74107","SUMMIT ESP, LLC","SUMMIT ESP, LLC TULSA HEADQUARTERS|835 WEST 41ST STREET SOUTH|TULSA, OK 74107","ORDER","","1598","KG","3","CM","5","AMASS INTERNATIONAL GROUP","AMIG","MOL MOTIVATOR","014E","AMIG303L304167","9475624","PEOPLES REP OF CHINA","LOS ANGELES","YANTIAN","","04/01/2013","HDMU6546855   ","5   ","DIFFUSER, BOTTOM, MACHINE SF1000 SERIES 400 P UMP IMPELLER, MACHINE, SF1000 5 VANE SERIES 400 P UMP DIFFUSER, MACHINE, SF1000 SERIES 400 PUMP THIS SHIPMENT CONTAINS WOODEN PACKING MATERIELS,HAS BEEN FUMIGATED.  HDMU6546855 ","HDMU6546855 ","SUMMIT ESP, LLCTULSA,OK,USAMADE IN  CHINA ","","SHENZHEN"
"MICNOVA PHOTO INDUSTRIAL CO LTD.","A16 BUILDING NEW MATRIAL INDUSTRIAL|PARK OF SILINCON VALLEY POWER,|GUANGLAN STREET SHENZHEN CHINA","DOT LINE CROP","9414 ETON AVE CHATSWORTH|CA 91311,USA|","DOT LINE CROP","9414 ETON AVE CHATSWORTH|CA 91311,USA|","ORDER","","296","KG","2","CM","13","AMASS INTERNATIONAL GROUP","AMIG","MOL MOTIVATOR","014E","AMIG303L304267","9475624","PEOPLES REP OF CHINA","LOS ANGELES","YANTIAN","","04/01/2013","HDMU6546855 ","13 ","METAL TRACK SLIDER THIS SHIPMENT CONTAINS NO SOLID WOOD PACKING MATERIALS  HDMU6546855 ","HDMU6546855 ","MICNOVA ","","SHENZHEN"
"HANGZHOU TONGQIAO TECHNOLOGY CO.LTD","DEEP BLUE PLAZA OFFICE BLDG.,|STE 1702A 203 CHAOHUI ROAD|HANGZHOU,CHINA 310014","ROUND BRIDGE,INC","19200 VON KARMAN AVENUE STE 500|IRVINE,CA 92612,USA|","ROUND BRIDGE,INC","19200 VON KARMAN AVENUE STE 500|IRVINE,CA 92612,USA|","ORDER","","146","KG","2","CM","10","AMASS INTERNATIONAL GROUP","AMIG","MOL MOTIVATOR","014E","AMIG303L304281","9475624","PEOPLES REP OF CHINA","LOS ANGELES","YANTIAN","","04/01/2013","HDMU6546855 ","10 ","MEDICAL CART THIS SHIPMENT CONTAINS NO SOLID WOOD PACKING MATERIALS  HDMU6546855 ","HDMU6546855 HDMU6546855 ","ROUND BRIDGE,INCGLOBAL SOLUTIONS19200 VON KARMANAVE.STE 500IRVINE,CA 92612LOT NUMBER// PART NUMBERQUANTITYUNIT GROSS WEIGHTUNIT NET WEIGHTVNIT VOLUMECARTON NUMBERTOTAL CARTONS ","","SHENZHEN"
"CMT SOURCING GROUP LTD.","863 JIEFANG ROAD, 10/F|GUANGZHOU,CHINA|","EASTERN BROTHER TRADING INC.","137-03 BOOTH MEMORIAL AVE,|FLUSHING,NY 11355|","COASTAR FREIGHT SERVICE INC.","1614 POTRERO AVE. SUITE #C|SOUTH EL MONTE, CA 91733|","ORDER","","1044","KG","7","CM","129","AMASS INTERNATIONAL GROUP","AMIG","MOL MOTIVATOR","014E","AMIG303L304456","9475624","PEOPLES REP OF CHINA","LOS ANGELES","YANTIAN","","04/01/2013","HDMU6546855 ","129 ","LADIES' GARMENT THIS SHIPMENT CONTAINS NO SOLID WOOD PACKING MATERIALS  HDMU6546855 ","HDMU6546855 ","CMT WHOLESALECORP.PO NO.:STYLE NO.:COLOR(), PRE PACK:TOTAL UNITS:TOTAL PREPACKRN:127572 ","","SHENZHEN"
"EASTRISING TECHNOLOGY CO.,LTD","FLOOR 6,BUILDING A1,ZHUJIANG|HONGLINGZHONG ROAD,SQUARE ZHONGXIN|CHENG ,LONGGANG DISTRICT,CHINA","BRASITECH INDUSTRIA E.COM.","DE APARELHOS|PARA BELEZA LTDA RUA PALMEIRA DO|MIRITI,1413 DISTRITO INDUSTRIAL","BRASITECH INDUSTRIA E.COM.","DE APARELHOS|PARA BELEZA LTDA RUA PALMEIRA DO|MIRITI,1413 DISTRITO INDUSTRIAL","ORDER","","178","KG","1","CM","7","AMASS INTERNATIONAL GROUP","AMIG","MOL MOTIVATOR","014E","AMIGMAXLAX905810","9475624","PEOPLES REP OF CHINA","LOS ANGELES","YANTIAN","","04/01/2013","HDMU6546855  ","7  ","ELECTRONIC COMPONENTS THIS SHIPMENT CONTAINS NO SOLID WOOD PACKING MATERIALS  HDMU6546855 ","HDMU6546855 ","1-7 ","","SHENZHEN"
"STARRY ADVANCE LIMITED","FLAT A, 9/F, LIBERTY MANSION|26E JORDAN RD.,YAUMATEI,|KL HONG KONG","KEISER CORPORATION","2470 SOUTH CHERRY AVE.,|FRESNO, CA 93706, USA|","USA CARGO LINE","15934 HESPERIAN BLVD # 159|SAN LORENZO CA 94580|JOHNSON LEE","ORDER","","2252","KG","3","CM","126","AMASS INTERNATIONAL GROUP","AMIG","MOL MOTIVATOR","014E","AMIG303L304492","9475624","PEOPLES REP OF CHINA","LOS ANGELES","YANTIAN","","04/01/2013","HDMU6546855  ","126  ","STAINLESS STEEL AXEL COMPONENT THIS SHIPMENT CONTAINS NO SOLID WOOD PACKING MATERIALS  HDMU6546855 ","HDMU6546855 ","KEISER ","","SHENZHEN"
"SHENZHEN BEST WAY PACKAGING PRODUCT","CO.,LTD|LI HENG LONG INDUSTRIAL PARK,|BOTANICAL GARDEN,NAN LIAN,CHINA","OD INTERNATIONAL","9430 LURLINE AVE. CHATSWORTH|CA 91311|","OD INTERNATIONAL","9430 LURLINE AVE. CHATSWORTH|CA 91311|","ORDER","","924","KG","7","CM","130","AMASS INTERNATIONAL GROUP","AMIG","MOL MOTIVATOR","014E","AMIG303L304521","9475624","PEOPLES REP OF CHINA","LOS ANGELES","YANTIAN","","04/01/2013","HDMU6546855   ","130   ","TENSELESS SERUM BOX 50CTNS SMOOTHING EYE SERUM BOX 50CTNS HYDROL COLLAGEN SERUM BOX 30CTNS THIS SHIPMENT CONTAINS NO SOLID WOOD PACKING MATERIALS  HDMU6546855 ","HDMU6546855 ","OD INTERNATIONAL INCP0#SKU:DESCRIPTION:CARTON#.:QTY.G.W.: ","","SHENZHEN"
"SHEN ZHEN HAN HUI PLASTIC","PRODUCTION CO.,LTD|9 BLOCK,THE THIRD INDUSTRIAL ZONE|OF ZHU KENG,PING SHAN,CHINA","DREAM BRANDS","11645 N CAVE CREEK RD|PHOENIX, AZ 85020-1300|","DREAM BRANDS","11645 N CAVE CREEK RD|PHOENIX, AZ 85020-1300|","ORDER","","1065","KG","9","CM","121","AMASS INTERNATIONAL GROUP","AMIG","MOL MOTIVATOR","014E","AMIG303L304525","9475624","PEOPLES REP OF CHINA","LOS ANGELES","YANTIAN","","04/01/2013","HDMU6546855  ","121  ","HF15020-B 20ML PET CLEAR BOTTLE FLIP CAP CLEAR COLOR THIS SHIPMENT CONTAINS NO WOOD PACKING MATERIEALS  HDMU6546855 ","HDMU6546855 ","BOTTLE, 20MLITEM#51024QTY: 1,650 PCSPO# :111300MFG.DATE: MM/DD/YYLOT #: DB-001MADE IN CHINACAP, FLIP TOP, FO ","","SHENZHEN"
"YANGJIANG YAL SHENGDA INDUSTRIAL","CO., LTD.|BEI GUAN INDUSTRIAL DEVELOPMENT|ZONE,YANGDONG,YANGJIANG,CHINA","TEJEN INC","13171 N. TANNER ROBERT DR|ORO VALLEY AZ 85755|","TEJEN INC","13171 N. TANNER ROBERT DR|ORO VALLEY AZ 85755|","ORDER","","2212","KG","10","CM","140","AMASS INTERNATIONAL GROUP","AMIG","MOL MOTIVATOR","014E","AMIG303L304530","9475624","PEOPLES REP OF CHINA","LOS ANGELES","YANTIAN","","04/01/2013","HDMU6546855 ","140 ","KNIFE THIS SHIPMENT CONTAINS NO SOLID WOOD PACKING MATERIALS  HDMU6546855 ","HDMU6546855 ","TEJEN INCDESCRIPTION:QTY:DIM:CTN#:  OFMADE IN P.R.C ","","SHENZHEN"
"V-MARK ENTERPRISES LTD.","8-9F,BUILDING NO.1,1ST STREET,KEHUI|JINGU NO.99 KEXUE DADAO,KEXUE CHENG|LUOGANG DISTRICT, GUANGZHOU CHINA","CHESTNUT INVESTMENT GROUP INC","1605 JOHN ST.#302|FORT LEE, NJ 07024 U.S.A.|","APEX TACKLE CORP","800D STREET|SOUTH SOIUX CITY, NE 68776|","ORDER","","368","KG","4","CM","52","AMASS INTERNATIONAL GROUP","AMIG","MOL MOTIVATOR","014E","AMIGMA33L61550","9475624","PEOPLES REP OF CHINA","LOS ANGELES","YANTIAN","","04/01/2013","HDMU6546855 ","52 ","FISHING TACKLES THIS SHIPMENT CONTAINS NO SOLID WOOD PACKING MATERIALS  HDMU6546855 ","HDMU6546855 ","CIGCASE#ORDER# ","","SHENZHEN"
"ACCESS ASIA NOW","#904,JIN HAO PAVILION,GOLDEN SEA|GARDEN,#616 TIAN HE,,GUANGDONG,|GUANGZHOU,510630","PACIFIC BRIDGE , INC.","1578 EAST KIMBERLY AVE.FULLERTON,|CA 92831|CONTACT:KAILASH","PARISI SERVICES","8625 AVIATION BLVD.|INGLEWOOD, CA90301|","ORDER","","2700","KG","16","CM","150","AMASS INTERNATIONAL GROUP","AMIG","MOL MOTIVATOR","014E","AMIGSA33L61578","9475624","PEOPLES REP OF CHINA","LOS ANGELES","YANTIAN","","04/01/2013","HDMU6546855 ","150 ","ALLURE ZEBRA TOTE THIS SHIPMENT CONTAINS NO SOLID WOOD PACKING MATERIALS  HDMU6546855 ","HDMU6546855 ","PO # 29635REF # 7336ITEM # ALL275ALLURE ZEBRA TOTEQTY/CTNPARSONSKELLOGGMADE IN CHINACTN/NO 1-UP ","","SHENZHEN"
"GUANGDONG YUNFU FOREIGN TRADE LIGHT","INDUSTRIAL PRODUCTS ARTS AND CRAFTS|LIMITED NO.108,XINYUN EAST ROAD,|YONFU CITY,GUANGDONG,PR.CHINA","SOLI STONE,INC.","18409 E.VALLEY BLVD.,LA PUENTE,|CA 91744,U.S.A|","SOLI STONE,INC.","18409 E.VALLEY BLVD.,LA PUENTE,|CA 91744,U.S.A|","ORDER","","680","KG","1","CM","1","AMASS INTERNATIONAL GROUP","AMIG","MOL MOTIVATOR","014E","AMIGSA33L61628","9475624","PEOPLES REP OF CHINA","LOS ANGELES","YANTIAN","","04/01/2013","HDMU6546855 ","1 ","MARBLE MOSAIC THIS SHIPMENT HAS BEEN FUMIGATED.  HDMU6546855 ","HDMU6546855 ","SOLI36 ","","SHENZHEN"
"WIN2000 TELECOM.CO.,LTD","NO.3 MU LIANHENG ROAD, TIANXIN|VILLAGE,TANGXIA TOWN, DONGGUAN|CHINA 523718","NITE IZE, INC","MICHACL BOYD|6455 SPINE RD. BOULDER,|COLORADO 80301 USA","NITE IZE, INC","MICHACL BOYD|6455 SPINE RD. BOULDER,|COLORADO 80301 USA","ORDER","","63","KG","1","CM","10","AMASS INTERNATIONAL GROUP","AMIG","MOL MOTIVATOR","014E","AMIGEV33L61694","9475624","PEOPLES REP OF CHINA","LOS ANGELES","YANTIAN","","04/01/2013","HDMU6546855  ","10  ","WRAPL-IT PLASTIC TOP WRAPL-IT PLASTIC BOTTOM THIS SHIPMENT CONTAINS NO SOLID WOOD PACKING MATERIALS  HDMU6546855 ","HDMU6546855 ","WLT4L00WLT-4101 ","","SHENZHEN"
"SHIMMER SPRING LIMITED","RM 1708 NAN FUNG TOWER|173 DES VOEUX ROAD CENTRAL|HONG KONG, HONG KONG","ON CORP US INC","10920 VIA FRONTERA STE 540|SAN DIEGO CA 92127|USA","ON CORPORATION","6/F INDL BANK B/D 246-5 SEOHYUN|DONG BUNDANG-KU KYUNGKI-DO|SEONGNAM, KOREA SOUTH                        ","ORDER","","60822","KG","0","","5167","EXCEL NETWORK LIMITED","EXNW","MOL MOTIVATOR","14E","EXNWGSZS1303133","9475624","PEOPLES REP OF CHINA","LOS ANGELES","YANTIAN","","04/01/2013","BMOU5212513  BMOU5218297  CRSU9280676  DFSU6811190  HDMU6298548  HDMU6463149  ","866  858  865  858  862  858  ","RCA 31.5 INCH LED REAR LIT LCD HDTV WITH USB RCENT GOODS VALUE BY FREE OF CHARGE CARTON BO X REMOTE CONTROL SCREW POWER BOARD C  BMOU5212513 RCA 31.5 INCH LED REAR LIT LCD HDTV WITH USB RCENT GOODS VALUE BY FREE OF CHARGE CARTON BO X REMOTE CONTROL SCREW POWER BOARD C  BMOU5218297 RCA 31.5 INCH LED REAR LIT LCD HDTV WITH USB RCENT GOODS VALUE BY FREE OF CHARGE CARTON BO X REMOTE CONTROL SCREW POWER BOARD C  CRSU9280676 RCA 31.5 INCH LED REAR LIT LCD HDTV WITH USB RCENT GOODS VALUE BY FREE OF CHARGE CARTON BO X REMOTE CONTROL SCREW POWER BOARD C  DFSU6811190 RCA 31.5 INCH LED REAR LIT LCD HDTV WITH USB RCENT GOODS VALUE BY FREE OF CHARGE CARTON BO X REMOTE CONTROL SCREW POWER BOARD C  HDMU6298548 RCA 31.5 INCH LED REAR LIT LCD HDTV WITH USB RCENT GOODS VALUE BY FREE OF CHARGE CARTON BO X REMOTE CONTROL SCREW POWER BOARD C  HDMU6463149 ","BMOU5212513 BMOU5218297 CRSU9280676 DFSU6811190 HDMU6298548 HDMU6463149 ","PORT ATSC, 2 HDMI INPUT SPARE PARTS OF 0.5 PENO MARKS. PORT ATSC, 2 HDMI INPUT SPARE PARTS OF 0.5 PENO MARKS. PORT ATSC, 2 HDMI INPUT SPARE PARTS OF 0.5 PENO MARKS. PORT ATSC, 2 HDMI INPUT SPARE PARTS OF 0.5 PENO MARKS. PORT ATSC, 2 HDMI INPUT SPARE PARTS OF 0.5 PENO MARKS. PORT ATSC, 2 HDMI INPUT SPARE PARTS OF 0.5 PENO MARKS. ","","YANTIAN, CHINA"
